judul,deskripsi"Serial India Baru ANTV, Ini rating ‘Mahakaali’ dan ‘Takdir Lonceng Cinta’",
"Lamarannya Ditolak, Mas Pur Pingsan di ‘Tukang Ojek Pengkolan’",
"Menderita Batu Ginjal, Aly Goni Masuk Rumah Sakit",
"Ada Dangdut Koplo di ‘Tabligh Akbar’, Trans TV Banjir Kritik",iyaa.com | Jakarta: Di bulan Ramadan ini Trans TV menghadirkan sederet program spesial salah satunya...
"Rating ‘Di Sebelah Ada Surga’ Lemah, Netizen Salahkan Uus?","iyaa.com | Jakarta: Gantikan 3 Semprul Mengejar Surga, Di Sebelah Ada Surga jadi sinetron Ramadan..."
"‘Karma’ Dituduh Settingan, Pemilik Skenario yang Beredar Buka Suara",iyaa.com | Jakarta: Program Karma show ANTV kerap dituduh settingan dan hanya rekayasa. Roy Kiyoshi...
"Pakai Hot Pants dan Kaos Ketat, Ashanty Banjir Protes Netizen",
4 Mitos dan Fakta Seputar Aloe Vera Gel untuk Kecantikan,
"Serial India Baru ANTV, Ini rating ‘Mahakaali’ dan ‘Takdir Lonceng Cinta’",
"Lamarannya Ditolak, Mas Pur Pingsan di ‘Tukang Ojek Pengkolan’",
‘Tercyduk’ SCTV Asli Atau Settingan? Begini Jawaban Lionil Hendrik,
Serial Tokusatsu ‘Legend Hero’ akan Tayang di RTV,
"Yuk, Kenalan Sama Pemain & Karakter ‘APACE, Anak Punk Anti Cewek’ RCTI",
"Pindah Jam Tayang, ‘Hafizah’ Masuki Episode Terakhir di RCTI",
"Kocak, Gilang Dirga Tirukan Roy Kiyoshi di ‘Stand Up Comedy Academy’","iyaa.com | Jakarta: Gilang Dirga tak hanya berbakat sebagai host, namun ia pandai menirukan gaya..."
"Gabung ‘Anak Langit’, Intip Gaya Cool Anjasmara yang Bikin Caesar Hito Kagum","iyaa.com | Jakarta: Aktor senior Indonesia, Anjasmara ikut bergabung dalam sinetron Anak Langit SCTV. Hal..."
"Tayang Perdana di RCTI, ‘Amanah Wali 2’ & ‘Aku Bukan Ustadz’ Raih Rating Tinggi",iyaa.com | Jakarta: Sederet program religi hadir menemani santap sahur dan berbuka puasa selama Ramadan....
"Menderita Batu Ginjal, Aly Goni Masuk Rumah Sakit",
‘Tercyduk’ SCTV Asli Atau Settingan? Begini Jawaban Lionil Hendrik,
Serial Tokusatsu ‘Legend Hero’ akan Tayang di RTV,
"Digosipkan Pacaran, Arjit Taneja: Aku Sayang Mrunal Thakur Tapi…",
Hubungan Jasi Michelle – Bayu Lesmana Cuma Gimmick di ‘Ekspedisi Merah’?,
"Perdana Tampil Berhijab di TV, Intip Gaya Rock Tantri Kotak di ‘Idol’ 2018",
"Sinopsis ‘Dia yang Tak Terlihat’, Kisah Cinta Berbalut Misteri Pembunuhan",
"Pakai Hot Pants dan Kaos Ketat, Ashanty Banjir Protes Netizen",
4 Mitos dan Fakta Seputar Aloe Vera Gel untuk Kecantikan,
"Serial India Baru ANTV, Ini rating ‘Mahakaali’ dan ‘Takdir Lonceng Cinta’",
"Yuk, Kenalan Sama Pemain & Karakter ‘APACE, Anak Punk Anti Cewek’ RCTI",
"Pindah Jam Tayang, ‘Hafizah’ Masuki Episode Terakhir di RCTI",
"Mirip ‘Putri yang Ditukar’, Begini Sinopsis ‘Ada Dua Cinta’ RCTI",
"‘Pesbukers’ Balik ke Slot Sore, ‘Dil Se Dil Tak’ Dibungkus ANTV?",
"Lamarannya Ditolak, Mas Pur Pingsan di ‘Tukang Ojek Pengkolan’",
"Menderita Batu Ginjal, Aly Goni Masuk Rumah Sakit",
‘Tercyduk’ SCTV Asli Atau Settingan? Begini Jawaban Lionil Hendrik,
Serial Tokusatsu ‘Legend Hero’ akan Tayang di RTV,
"Raditya Dika Nikah, Baim Wong Jadi Raja Jomblo Selanjutnya?",
"Manfaat Argan Oil untuk Wajah, dari Kulit Mulus Hingga Sembuhkan Jerawat",
5 Gaya Cantik Natasha Wilona Mirip Artis Korea,
"Yuk, Kenalan Sama Pemain & Karakter ‘APACE, Anak Punk Anti Cewek’ RCTI",
"Pindah Jam Tayang, ‘Hafizah’ Masuki Episode Terakhir di RCTI",
"Bukan Karena Rating, Ini Alasan SCTV Tamatkan ‘Cinta Kedua’",
"Sinopsis ‘Dia yang Tak Terlihat’, Kisah Cinta Berbalut Misteri Pembunuhan",
"Mirip ‘Putri yang Ditukar’, Begini Sinopsis ‘Ada Dua Cinta’ RCTI",
"‘Pesbukers’ Balik ke Slot Sore, ‘Dil Se Dil Tak’ Dibungkus ANTV?",
"5 Mitos Soal Deodoran Ini Sering Dipercaya, Faktanya Ternyata Beda Banget!",
Ussy Sulistiawaty Rilis Ulang Lini Kosmetik Dissy,
"Sinopsis ‘Dia yang Tak Terlihat’, Kisah Cinta Berbalut Misteri Pembunuhan",
"Mirip ‘Putri yang Ditukar’, Begini Sinopsis ‘Ada Dua Cinta’ RCTI",
"‘Pesbukers’ Balik ke Slot Sore, ‘Dil Se Dil Tak’ Dibungkus ANTV?",
"Akting Bareng Siddharth Shukla dan Rohan Gandotra, Ini yang Beda Menurut Rashami Desai",iyaa.com | New Delhi: Rashami Desai telah mundur dari serial Dil Se Dil Tak pada...
"Sudah Hengkang, Rashami Desai Komentari Tamatnya ‘Dil Se Dil Tak’ di India",iyaa.com | New Delhi: Serial Dil Se Dil Tak di ANTV telah dihentikan penayangannya sejak...
Contek 3 Tips Seleb Hollywood Ini Supaya Kulitmu tidak Dehidrasi selama Puasa,iyaa.com | Jakarta: Salah satu masalah selain bibir kering di bulan puasa adalah kulit yang...
"Biasa Macho, Ashish Sharma Tak Khawatir Perankan Transgender di Film ‘Khejdi’","iyaa.com | New Delhi: Sepanjang kariernya sebagai aktor, Ashish Sharma telah memerankan berbagai macam karakter,..."
Tips Makeup Natural Ala Lizzie Parra Agar Tetap Segar Selama Puasa,"iyaa.com | Jakarta: Riasan wajah natural dan flawless kini jadi tren kecantikan. Namun selama puasa,..."
"Lucu Banget, Spectrum x Disney Rilis Koleksi Brush Little Mermaid","iyaa.com | Jakarta: Setelah beberapa waktu lalu beredar produk kecantikan bertema Mickey Mouse, kali ini..."
Wishnutama Ungkap Alasan Undang Via Vallen di Indonesian Choice Awards 5.0,"iyaa.com | Jakarta: Wishnutama, Co-founder dan CEO NET TV mengungkap alasan hadirkan musik dangdut dalam..."
"Kecewa ‘Ada Dua Cinta’ Tamat, Rizky Billar Siapkan Sinetron Baru","iyaa.com | Jakarta: Rizky Billar akui sempat terkejut dan kecewa saat mengetahui sinetron yang dibintanginya,..."
"Innalillahi, Gogon Srimulat Meninggal Dunia di Lampung","iyaa.com | Jakarta: Kabar duka datang dari pelawak senior, Gogon Margono atau yang populer dengan..."
10 Kesalahan Fatal Memakai Sheet Mask yang Tanpa Sadar Kamu Lakukan (Bag. 2),"iyaa.com | Jakarta: Meski praktis pemakaiannya, namun banyak orang masih salah dalam menggunakan sheet mask...."
10 Kesalahan Fatal Memakai Sheet Mask yang Tanpa Sadar Kamu Lakukan (Bag. 1),"iyaa.com | Jakarta: Sheet mask, inovasi terbaru dari masker wajah ini sangat membantu kamu yang..."
"Dari Raisa Hingga Ayu Ting Ting, Ini Foto 6 Seleb No Edit No Photoshop","iyaa.com | Jakarta: Kerap memotret selebriti papan atas, fotografer ternama Indonesia, Rio Motret memposting 6..."
"Serial Shakti Arora dan Drashti Dhami Dipromosikan, Ini Judulnya","iyaa.com | Jakarta: Kabar baik buat penggemar Shakti Arora dan Drashti Dhami, kedua aktor India..."
"Abhishek Nigam, Kakak Siddharth Nigam yang Tak Kalah Ganteng",iyaa.com | Jakarta: Nama Siddharth Nigam sudah cukup populer di Indonesia. Ia dikenal sebagai bintang...
Cerita Rizky Billar Jadi Pemeran Utama Setelah Gantikan Arbani Yasiz,iyaa.com | Jakarta: Rizky Billar bukan pendatang baru di dunia hiburan tanah air. Aktor berwajah...
"Jerawatan Saat Coba Produk Baru, Purging atau Breakout? Kenali Perbedaannya!",iyaa.com | Jakarta: Kamu pernah tidak wajahmu tiba-tiba jerawatan setelah mencoba produk skincare baru? Kalau...
5 Tips Makeup Mudah Agar Wajahmu Terlihat Baby Face,iyaa.com | Jakarta: Banyak wanita ingin terlihat cantik dan imut ala baby face. Tampilan ini...
5 Rahasia Kecantikan Selena Gomez yang Bisa Kamu Tiru di Rumah,"iyaa.com | Jakarta: Rambut yang tebal, mata besar, pipi sedikit chubby, kulit mulus, dan bibir..."
"Maksimalkan Manfaat Face Mist, Ini Waktu yang Tepat Memakainya",iyaa.com | Jakarta: Face mist tentu bukan barang baru dalam dunia kecantikan. Manfaatnya telah dikenal...
"Foto Bareng, Mulan Jameela – Krisdayanti bikin Squad?",iyaa.com | Jakarta: Baru-baru ini netizen dihebohkan dengan foto Mulan Jameela bersama sekumpulan wanita dengan...
"Pakai Hot Pants dan Kaos Ketat, Ashanty Banjir Protes Netizen",
4 Mitos dan Fakta Seputar Aloe Vera Gel untuk Kecantikan,
"Serial India Baru ANTV, Ini rating ‘Mahakaali’ dan ‘Takdir Lonceng Cinta’",
"Pakai Hot Pants dan Kaos Ketat, Ashanty Banjir Protes Netizen",
4 Mitos dan Fakta Seputar Aloe Vera Gel untuk Kecantikan,
"Serial India Baru ANTV, Ini rating ‘Mahakaali’ dan ‘Takdir Lonceng Cinta’",
"Lamarannya Ditolak, Mas Pur Pingsan di ‘Tukang Ojek Pengkolan’",
"Menderita Batu Ginjal, Aly Goni Masuk Rumah Sakit",
‘Tercyduk’ SCTV Asli Atau Settingan? Begini Jawaban Lionil Hendrik,
"Lamarannya Ditolak, Mas Pur Pingsan di ‘Tukang Ojek Pengkolan’",
"Menderita Batu Ginjal, Aly Goni Masuk Rumah Sakit",
‘Tercyduk’ SCTV Asli Atau Settingan? Begini Jawaban Lionil Hendrik,
Serial Tokusatsu ‘Legend Hero’ akan Tayang di RTV,
Serial Tokusatsu ‘Legend Hero’ akan Tayang di RTV,
"Yuk, Kenalan Sama Pemain & Karakter ‘APACE, Anak Punk Anti Cewek’ RCTI",
"Pindah Jam Tayang, ‘Hafizah’ Masuki Episode Terakhir di RCTI",
"Yuk, Kenalan Sama Pemain & Karakter ‘APACE, Anak Punk Anti Cewek’ RCTI",
"Pindah Jam Tayang, ‘Hafizah’ Masuki Episode Terakhir di RCTI",
Citra Scholastika Jagokan Marion Jola di ‘Indonesian Idol 2018’,
"Sinopsis ‘Mahluk Manis Dalam Bis’, Saat Emiliano Cortizo & Panji Zoni Jatuh Cinta",
"Melenceng dari Nilai Islami, ‘Catatan Harian Aisha’ Kecewakan Penonton",
Ini Alasan NET Undang Craig David & Hailee Steinfeld di Indonesian Choice Awards 5.0,
6 Tips Tampil Lebih Modis dengan Kaos dan Jeans,
Megan Domani Jadi Pasangan Rizky Nazar di Sinetron Baru SCTV?,"iyaa.com | Jakarta: Rizky Nazar sukses dipasangkan dengan Cut Syifa dalam beberapa sinetron SCTV. Selanjutnya,..."
Rizky Nazar dan Irish Bella Pose Mesra di Poster ‘Ketika Kau dan Aku Bertemu’,"iyaa.com | Jakarta: Menyusul Malaikat Cinta, poster Ketika Kau dan Aku Bertemu juga telah dirilis...."
"Sudah Tiba, Shweta Basu Prasad ‘Chandra Nandini’: Halo Indonesia!",
"Sinopsis ‘Dia yang Tak Terlihat’, Kisah Cinta Berbalut Misteri Pembunuhan",
"Mirip ‘Putri yang Ditukar’, Begini Sinopsis ‘Ada Dua Cinta’ RCTI",
"Sinopsis ‘Dia yang Tak Terlihat’, Kisah Cinta Berbalut Misteri Pembunuhan",
"Mirip ‘Putri yang Ditukar’, Begini Sinopsis ‘Ada Dua Cinta’ RCTI",
"‘Pesbukers’ Balik ke Slot Sore, ‘Dil Se Dil Tak’ Dibungkus ANTV?",
"Video Spesial Ramadan ‘Anak Langit’ Dirilis, Trio Kadal Paling Dinanti","iyaa.com | Jakarta: Anak Langit rilis video spesial Ramadan. Hadir dengan nuansa religi, para pemain..."
"Sedih Banget, Rionaldo Stokhorst – Naysilla Mirdad Resmi Bercerai di ‘Orang Ketiga’","iyaa.com | Jakarta: Setelah lika-liku yang cukup panjang, rumah tangga Rionaldo Stokhorst dan Naysilla Mirdad..."
"Promo ‘Cuma Disini’ Pakai Adegan Ini, Bikin Kangen ‘Para Pencari Tuhan’","iyaa.com | Jakarta: Gantikan Para Pencari Tuhan, sinetron Cuma Disini temani santap sahur penonton setia..."
"‘Pesbukers’ Balik ke Slot Sore, ‘Dil Se Dil Tak’ Dibungkus ANTV?",
"Poster ‘Malaikat Cinta’ Dirilis, Netizen Bahas Sinetron yang Bakal Tamat",iyaa.com | Jakarta: Sejumlah sinetron baru dihadirkan SCTV dan beberapa di antaranya telah tayang. Salah...
"Duh, Deswita Maharani & Ferry Maryadi Bercerai di ‘Tetangga Tapi Mantan’ RCTI","iyaa.com | Jakarta: Setelah sukses dengan Kompleks Pengabdi Istri bersama Komeng, RCTI kembali hadirkan sitkom..."
Ucapan Terima Kasih Pemain Usai Tamatnya ‘Cinta Kedua’ di SCTV,iyaa.com | Jakarta: Dibungkusnya sinetron Cinta Kedua menuai kekecewaan sejumlah netizen. Sinetron yang dibintangi Dude...
"‘Cinta Kedua’ Mendadak Tamat, SCTV Kecewakan Penonton","iyaa.com | Jakarta: Sinetron Cinta Kedua mendadak tamat kemarin sore, Rabu (16/5/2018). Hal ini diumumkan..."
Jadwal Tayang Sinetron dan Program Ramadan 2018 di RCTI,"iyaa.com | Jakarta: Di bulan suci Ramadan, RCTI menghadirkan berbagai program menarik yang tak hanya..."
"Pakai Hot Pants dan Kaos Ketat, Ashanty Banjir Protes Netizen",
4 Mitos dan Fakta Seputar Aloe Vera Gel untuk Kecantikan,
"Serial India Baru ANTV, Ini rating ‘Mahakaali’ dan ‘Takdir Lonceng Cinta’",
"Lamarannya Ditolak, Mas Pur Pingsan di ‘Tukang Ojek Pengkolan’",
"Menderita Batu Ginjal, Aly Goni Masuk Rumah Sakit",
‘Tercyduk’ SCTV Asli Atau Settingan? Begini Jawaban Lionil Hendrik,
Serial Tokusatsu ‘Legend Hero’ akan Tayang di RTV,
"Yuk, Kenalan Sama Pemain & Karakter ‘APACE, Anak Punk Anti Cewek’ RCTI",
"Pindah Jam Tayang, ‘Hafizah’ Masuki Episode Terakhir di RCTI",
"Soal Fashion, Vanesha Prescilla dan Sissy Priscillia Sering Bertengkar",
"Sinopsis ‘Aluna’, Kisah Gadis Berkebutuhan Khusus Dengan Bakat Istimewa",
"Raditya Dika Nikah, Baim Wong Jadi Raja Jomblo Selanjutnya?",
"Sinopsis ‘Dia yang Tak Terlihat’, Kisah Cinta Berbalut Misteri Pembunuhan",
"Mirip ‘Putri yang Ditukar’, Begini Sinopsis ‘Ada Dua Cinta’ RCTI",
"‘Pesbukers’ Balik ke Slot Sore, ‘Dil Se Dil Tak’ Dibungkus ANTV?",
"Pakai Lip Balm Saat Bibir Pecah-Pecah di Bulan Puasa Bisa Bikin Ketergantungan, Faktanya…",iyaa.com | Jakarta: Kondisi bibir yang pecah-pecah merupakan hal biasa di bulan Ramadan. Tapi bibir...
Hidrasi Kulitmu dengan Cepat selama Berpuasa dengan 2 Sheet Mask Lokal Ini,"iyaa.com | Jakarta: Tidak hanya tubuh, kulitmu juga bisa dehidrasi selama berpuasa loh ladies. Untuk..."
DIY Face Mist Bahan Alami yang Bikin Tetap Segar Selama Puasa,iyaa.com | Jakarta: Dehidrasi jadi masalah yang paling sering terjadi selama puasa. Agar tetap segar...
"Mengejutkan, Ini Fakta Sebenarnya tentang Sheet Mask",iyaa.com | Jakarta: Belakangan ini sheet mask tengah digemari oleh para wanita. Produk kecantikan yang...
"Tak Lagi Single, Tengku Tezi ‘Ekspedisi Merah’ Menikah dengan Danisa Chairiyah","iyaa.com | Jakarta: Tak hanya Raditya Dika yang melangsungkan pernikahan pada Sabtu, 5 Mei 2018..."
"Rambut ‘Berantakan’ Meghan Markle di Royal Wedding Dikritik, Ini Klarifikasi Hairstylist",iyaa.com | Jakarta: Sudah hampir 1 minggu sejak Royal Wedding Pangeran Harry dan Meghan Markle...
"Fakta Mengejutkan Di Balik Kehamilan Lucinta Luna, Ternyata…",iyaa.com | Jakarta: Lucinta Luna Kembali menghebohkan dunia maya. Personil Duo Bunga yang kerap menuai...
Contek Trik Makeup Artist Kendall Jenner untuk Bikin Bibir Terlihat Penuh dengan Lip Liner,iyaa.com | Jakarta: Bibir yang terlihat penuh jadi dambaan banyak perempuan. Lip liner biasa jadi...
Pooja Banerjee ‘Chandra Nandini’ Siap Ramaikan ‘Pesbukers Ramadan’,iyaa.com | Jakarta: Beberapa waktu lalu para putri cantik dari serial Chandra Nandini telah berkunjung...
"Gara-Gara Adegan ‘IKRS’ Ini, Mishal Raheja Keramas Hingga 10 Kali","iyaa.com | New Delhi: Untuk melakukan suatu adegan, tak jarang dibutuhkan usaha lebih dari sang..."
"Cegah Dehidrasi selama Puasa, Intip Cara Putri Kerajaan Inggris Merawat Wajah",iyaa.com | Jakarta: Dehidrasi jadi masalah utama yang sering terjadi selama puasa. Terdapat beragam cara...
DIY Masker Wajah untuk Menghidrasi Kulit,iyaa.com | Jakarta: Menjaga kulit tetap terhidrasi selama berpuasa memang perlu dilakukan. Cara yang paling...
"Telat Datang di Pembukaan Pop-Up Storenya, Kylie Jenner Buat Fans Marah","iyaa.com | Jakarta: Salah satu bisnis kosmetik tersukses milik selebriti adalah kepunyaan Kylie Jenner, yaitu..."
Karishma Tanna dan Rajat Tokas Dansa Romantis di Teaser ‘Naagin 3’,iyaa.com | Jakarta: Serial Naagin Season 3 akan segera tayang di India. Teaser pertamanya pun...
"Mirip Jung Hae In, Kenny Austin Disebut Cocok dengan Syifa Hadju",iyaa.com | Jakarta: Kenny Austin bertemu dengan Syifa Hadju dalam sinetron Ada Dua Cinta RCTI....
"Cantik Berhijab, Pemain Wanita ‘Anak Langit’ Malah Disebut Mirip Sales Kosmetik?","iyaa.com | Jakarta: Sambut Ramadan 2018, segenap kru dan pemain Anak Langit SCTV siapkan video..."
"Masih Jadi Tren, Supermodel Rosie Huntington-Whiteley Ikut Rilis Beauty Brand Sendiri",iyaa.com | Jakarta: Bisnis di dunia kecantikan nampaknya masih menjadi favorit para selebriti. Kali ini...
"Pakai Hot Pants dan Kaos Ketat, Ashanty Banjir Protes Netizen",
Devish Ahuja Pemeran Yama Muda di Serial ‘Shani’,iyaa.com | Jakarta: Para pemain serial Shani akan datang ke Indonesia pada bulan Ramadan nanti....
"Anissa Aziza Disambut Mahluk Halus di Rumahnya, Raditya Dika Kaget Ada Sosok Ini",iyaa.com | Jakarta: Anissa Aziza dapat sambutan horor di hari pertamanya tinggal di rumah Raditya...
"OK-JEK Tamat di NET TV, Pemain Tulis Salam Perpisahan","iyaa.com | Jakarta: Setelah hampir 3 tahun tayang di layar kaca, OK-JEK masuki episode terakhirnya..."
"Setelah 3 Tahun Tayang, OK-JEK Bakal Tamat di NET TV?","iyaa.com | Jakarta: Jelang Ramadan 2018, kabar menyedihkan datang dari sitkom OK-JEK yang tayang di..."
4 Mitos dan Fakta Seputar Aloe Vera Gel untuk Kecantikan,
"Serial India Baru ANTV, Ini rating ‘Mahakaali’ dan ‘Takdir Lonceng Cinta’",
"Lamarannya Ditolak, Mas Pur Pingsan di ‘Tukang Ojek Pengkolan’",
"Dipastikan ke Indonesia, Kartikey Malviya ‘Shani’ Sapa Penggemar","iyaa.com | Jakarta: Bulan Ramadan nanti, ANTV kembali menghadirkan sejumlah artis-artis India dan salah satunya..."
"Hari Pertama Di Rumah Raditya Dika, Anissa Aziza Diteror Mahluk Halus?","iyaa.com | Jakarta: Raditya Dika resmi menikah dengan Anissa Aziza pada Sabtu (5/5/2018). Usai menikah,..."
‘Ishq Ka Rang Safed’ MNCTV Masuki Season Break Jelang Ramadan,iyaa.com | Jakarta: Penggemar serial Ishq Ka Rang Safed tampaknya mesti bersabar menantikan kelanjutan kisah...
"Jelang Ramadan, ‘Dil Se Dil Tak’ Tayang Episode Terakhir","iyaa.com | Jakarta: Di Ramadan nanti, ANTV telah menyiapkan program-program seru selama bulan puasa. Namun..."
"Menderita Batu Ginjal, Aly Goni Masuk Rumah Sakit",
‘Tercyduk’ SCTV Asli Atau Settingan? Begini Jawaban Lionil Hendrik,
Serial Tokusatsu ‘Legend Hero’ akan Tayang di RTV,
"Pakai Hot Pants dan Kaos Ketat, Ashanty Banjir Protes Netizen",
4 Mitos dan Fakta Seputar Aloe Vera Gel untuk Kecantikan,
"Segera, Sinetron Ramadan ‘4 Penjuru Menuju Kiblat’ Dibintangi Fauzan Nasrul","iyaa.com | Jakarta: Ramadan tahun ini, sinetron-sinetron bertema religi siap menghiasi layar kaca. Salah satunya..."
Episode Perdana ‘Roy Kiyoshi Anak Indigo’ Raih Rating Tinggi di ANTV,"iyaa.com | Jakarta: Geser slot Karma show, sinetron Roy Kiyoshi Anak Indigo tayang perdana semalam,..."
"‘The Mask Singer Season 3’ Siap Tayang, Tora Sudiro Jadi Panelis",iyaa.com | Jakarta: Program The Mask Singer Indonesia telah sukses diadakan sebanyak dua musim. Acara...
"Yuk, Kenalan Sama Pemain & Karakter ‘APACE, Anak Punk Anti Cewek’ RCTI",
"Pindah Jam Tayang, ‘Hafizah’ Masuki Episode Terakhir di RCTI",
"Serial India Baru ANTV, Ini rating ‘Mahakaali’ dan ‘Takdir Lonceng Cinta’",
"Lamarannya Ditolak, Mas Pur Pingsan di ‘Tukang Ojek Pengkolan’",
"Raih Gelar Juara Pertama ‘LIDA’, Selfi: Ini Awal Perjuangan Saya","iyaa.com | Jakarta: Duta asal Sulawesi Selatan, Selfiyani alias Selfi, akhirnya sukses merebut gelar juara..."
"Selamat, Selfi Sukses Juarai ‘Liga Dangdut Indonesia’!","iyaa.com | Jakarta: Setelah melalui perjalanan panjang, Selfi berhasil memenangkan Liga Dangdut Indonesia (LIDA). Duta..."
"ANTV Kenang Olga Syahputra, Netizen Kangen ‘Pesbukers’ Jaman Dulu",
"Wah, Sinetron ‘Tersanjung’ Bakal Diangkat ke Layar Lebar!",
"Menderita Batu Ginjal, Aly Goni Masuk Rumah Sakit",
‘Tercyduk’ SCTV Asli Atau Settingan? Begini Jawaban Lionil Hendrik,
Serial Tokusatsu ‘Legend Hero’ akan Tayang di RTV,
"Pakai Hot Pants dan Kaos Ketat, Ashanty Banjir Protes Netizen",
4 Mitos dan Fakta Seputar Aloe Vera Gel untuk Kecantikan,
"Serial India Baru ANTV, Ini rating ‘Mahakaali’ dan ‘Takdir Lonceng Cinta’",
"Cuci Muka Pakai Facial Cleansing Brush, Perlu Gak Sih?",
"Sinopsis ‘Dia yang Tak Terlihat’, Kisah Cinta Berbalut Misteri Pembunuhan",
"Mirip ‘Putri yang Ditukar’, Begini Sinopsis ‘Ada Dua Cinta’ RCTI",
"Yuk, Kenalan Sama Pemain & Karakter ‘APACE, Anak Punk Anti Cewek’ RCTI",
"Pindah Jam Tayang, ‘Hafizah’ Masuki Episode Terakhir di RCTI",
"Lamarannya Ditolak, Mas Pur Pingsan di ‘Tukang Ojek Pengkolan’",
"Menderita Batu Ginjal, Aly Goni Masuk Rumah Sakit",
‘Tercyduk’ SCTV Asli Atau Settingan? Begini Jawaban Lionil Hendrik,
"‘Pesbukers’ Balik ke Slot Sore, ‘Dil Se Dil Tak’ Dibungkus ANTV?",
Kulit Kering dan Kusam Saat Mudik? Ini Tips Mudah Mengatasinya!,
Rahasia Marion ‘Indonesian Idol’ Agar Pede Saat Tampil,
"Endingnya Gantung, Penonton Nantikan ‘Tiada Hari yang Tak Indah’ Season 2 SCTV",
Serial Tokusatsu ‘Legend Hero’ akan Tayang di RTV,
"Yuk, Kenalan Sama Pemain & Karakter ‘APACE, Anak Punk Anti Cewek’ RCTI",
"Sinopsis ‘Dia yang Tak Terlihat’, Kisah Cinta Berbalut Misteri Pembunuhan",
"Mirip ‘Putri yang Ditukar’, Begini Sinopsis ‘Ada Dua Cinta’ RCTI",
"Pindah Jam Tayang, ‘Hafizah’ Masuki Episode Terakhir di RCTI",
"Bintangi Sinetron Ramadan, Rhoma Irama Ingin Terus Berkarya",
"‘Dibalik Kisah’, Angkat Kisah Nyata Beragam Kasus Kriminal Perdana di RCTI",
"‘Pesbukers’ Balik ke Slot Sore, ‘Dil Se Dil Tak’ Dibungkus ANTV?",
"Peringati Hari Bumi, Wardah Gelar Event Tukar Produk dengan Shopping Bag",
"Sinopsis ‘Dia yang Tak Terlihat’, Kisah Cinta Berbalut Misteri Pembunuhan",
"Mirip ‘Putri yang Ditukar’, Begini Sinopsis ‘Ada Dua Cinta’ RCTI",
"‘Pesbukers’ Balik ke Slot Sore, ‘Dil Se Dil Tak’ Dibungkus ANTV?",
"Beli Mobil Mewah, Kriss Hatta: Rezeki Orang Terdzolimi","iyaa.com | Jakarta: Permasalahan antara Kriss Hatta, Hilda Vitria Khan dan Billy Syahputra masih terus..."
"Peran Indah Indriana Jadi Jahat, Fans ‘Orang Ketiga’ Benci Tapi Cinta",iyaa.com | Jakarta: Indah Indriana alias Desi dulunya sangat disukai perannya di Orang Ketiga. Selain...
"Curhat di ‘Brownis Tonight’, Ini Pesan Kriss Hatta Untuk Hilda Vitria Khan","iyaa.com | Jakarta: Hadir sebagai bintang tamu di program Brownis Tonight Trans TV semalam, kamis..."
Rashami Desai dan Pratima Kannan ‘Uttaran’ Reuni di ‘Ishq Ka Rang Safed’,"iyaa.com | Jakarta: Masih ingat dengan wajah Pratima Kannan, pemeran Nenek Tapasya di serial Uttaran?..."
Bunga Citra Lestari Puji Duet Via Vallen & Boy William di ‘ICA 5.0’ NET,"iyaa.com | Jakarta: Ajang tahunan bergensi, Indonesian Choice Awards 5.0 NET kerap jadi pembicaraan netizen...."
"Kartikey Malviya ‘Shani’ Kasih Kode Mau ke Indonesia, Kapan?",iyaa.com | New Delhi: Kesuksesan Kartikey Malviya di serial Shani tak lepas dari keikutsertaannya di...
Mrunal Jain dan Madhurima Tuli Bintangi Film Pendek ’26th January’,iyaa.com | New Delhi: Belum lama ini Mrunal Jain dikabarkan akan membintangi versi serial TV...
"Devoleena Bhattacharjee Main Bareng Shakti Arora di ‘Baware Nain’, Ini Bocoran Plotnya",iyaa.com | New Delhi: Beberapa waktu lalu Shakti Arora dikabarkan membintangi serial baru berjudul Baware...
"Syuting Lagi, Lucinta Luna Siapkan Program baru di Trans TV?",iyaa.com | Jakarta: Lucinta Luna seakan tak henti membuat sensasi dan menghebohkan dunia maya. Beragam...
"Bongkar Aib Lucinta Luna, Mike Lewis Ogah Sebut Namanya","iyaa.com | Jakarta: Setelah video dna foto mesranya beredar, Mike Lewis akhirnya klarifikasi hubungannya dengan..."
"Niacinamide, Vitamin dalam Skincare yang Ampuh Atasi Bekas Jerawat Membandel","iyaa.com | Jakarta: Jerawat kadang suka bikin jengkel, apalagi kalau sampai meninggalkan bekas. Rasanya tuh..."
"Tayang Perdana, Kenalan Dulu Sama Karakter & Pemain ‘Cinta yang Hilang’ RCTI","iyaa.com | Jakarta: Sambut Ramadan 2018, RCTI hadirkan sinetron terbarunya berjudul Cinta yang Hilang. Sinetron..."
"Pakai Hot Pants dan Kaos Ketat, Ashanty Banjir Protes Netizen",
4 Mitos dan Fakta Seputar Aloe Vera Gel untuk Kecantikan,
"Tidak Hanya Menyegarkan Saat Berbuka Puasa, Ini Sederet Manfaat Air Kelapa untuk Kecantikan",iyaa.com | Jakarta: Kalau lagi berpuasa tentunya kamu ingin berbuka dengan yang segar-segar. Salah satu...
Tips Riasan Wajah Glowy dari MUA Meghan Markle,iyaa.com | Jakarta: Riasan wajah Meghan Markle saat pernikahannya dengan Pangeran Harry telah menarik perhatian....
"‘Cuma Disini’, Serial Ramadan Terbaru SCTV Gantikan ‘Para Pencari Tuhan’","iyaa.com | Jakarta: Setelah 11 tahun menemani sahur selama Ramadan di SCTV, Para Pencari Tuhan..."
"ANTV Hadirkan ‘Karma Baik’ Di Ramadan 2018, Jadwal Tayangnya Bikin Kaget","iyaa.com | Jakarta: Jelang Ramadan 2018, Sejumlah stasiun TV berlomba hadirkan program-program religi unggulannya. Beragam..."
"Serial India Baru ANTV, Ini rating ‘Mahakaali’ dan ‘Takdir Lonceng Cinta’",
"Lamarannya Ditolak, Mas Pur Pingsan di ‘Tukang Ojek Pengkolan’",
"Gak Cuma Si Putih Aja, Ini Tips Memilih Lipstik Nude Sesuai Warna Kulit!",iyaa.com | Jakarta: Lipstik nude kian digemari banyak perempuan. Trend yang satu ini digemari karena...
"Rihanna Bagi-Bagi Tips Makeup di Tutorial Makeup Routine-nya, Buruan Contek!",iyaa.com | Jakarta: Rihanna tentu bukan nama asing di industri kecantikan. Tidak hanya mempunyai makeup...
"Grand Final ‘LIDA’, Rara Ungguli Selfi dalam Perolehan Polling Sementara","iyaa.com | Jakarta: Dua duta terbaik, Rara dan Selfi, akhirnya bertemu di babak Grand Final..."
"Geser ‘Karma’ Show, Ini Jadwal Tayang ‘Roy Kiyoshi Anak Indigo’ di ANTV","iyaa.com | Jakarta: Setelah sukses dengan Karma show dan Karma The Series, ANTV hadirkan sinetron..."
"‘Anak Langit’ Syuting Promo Ramadan, Posisi Ammar Zoni Jadi Sorotan","iyaa.com | Jakarta: Menyambut datangnya Bulan Ramadan, segenap pemain Anak Langit jalani syuting promo ramadan...."
"Menderita Batu Ginjal, Aly Goni Masuk Rumah Sakit",
‘Tercyduk’ SCTV Asli Atau Settingan? Begini Jawaban Lionil Hendrik,
