judul,deskripsi"Pemain ‘Chandra Nandini’ Sapa Penggemar, Janji Bakal ke Indonesia",iyaa.com | Jakarta: Para penggemar Chandra Nandini akan berbahagia bulan Maret ini. Sebab pemain serial...
"Niat Serius Hingga Nikah, Verrell – Natasha Wilona Rencanakan Masa Depan",iyaa.com | Jakarta: Hubungan Verrell Bramasta dan Natasha Wilona nampaknya semakin serius. Dua bintang sinetron...
"Begini Urutan Tepat Penggunaan Skincare Pagi Hari, Kamu Sudah Betul?",iyaa.com | Jakarta: Sebelum pergi bekerja kamu pasti mengaplikasikan skincare ke kulitmu kan. Penggunaaan skincare...
Matte Lip Cream Merek Lokal yang Harganya di Bawah 100 Ribu,"iyaa.com | Jakarta: Inovasi baru yang terus bermunculan menghadirkan ragam pewarna bibir, salah satunya lip..."
"Tereliminasi di ‘Idol’, Bianca Jodie Gabung dengan Manajemen Ayu Ting Ting",iyaa.com | Jakarta: Bianca Jodie telah tersisih dari ajang Indonesian Idol 2018. Mimpinya menjadi juara...
"Dibenci di ‘Orang Ketiga’, Ini Pesan Fay Nabila Untuk Haters",iyaa.com | Jakarta: Fay Nabila kini miliki haters lantaran peran antagonis yang dilakoninya dalam sinetron...
"Ngamuk di Instagram, Kevin Torsten ‘Ekspedisi Merah’ Klarifikasi Berita Hoax",iyaa.com | Jakarta: Kevin Torsten ngamuk di instagram terkait berita hoax yang mencatut namanya. Dalam...
3 Lip Balm Terbaik untuk Kamu yang Punya Bibir Kering,"iyaa.com | Jakarta: Banyak orang yang mengalami masalah bibir kering. Penyebabnya pun bermacam-macam, mulai dari..."
"Ingin Ganti Belahan Rambut, Cocokkan Dulu dengan Bentuk Wajahmu",iyaa.com | Jakarta: Kamu pasti pernah atau bahkan sering mengganti gaya rambutmu bukan. Untuk yang...
Melody Prima Ungkap Alasan Dirinya Berhijab,iyaa.com | Jakarta: Melody Prima menambah deretan selebriti yang memutuskan untuk berhijab. Menyusul jejak Kartika...
Siddharth Nigam Ingin Jajal Serial Romantis dan Action,"iyaa.com | New Delhi: Setelah membintangi Chandra Nandini, Siddharth Nigam mencoba kemampuan aktingnya dengan menjadi..."
"Pakai Hot Pants dan Kaos Ketat, Ashanty Banjir Protes Netizen",
4 Mitos dan Fakta Seputar Aloe Vera Gel untuk Kecantikan,
"Pakai Hot Pants dan Kaos Ketat, Ashanty Banjir Protes Netizen",
4 Mitos dan Fakta Seputar Aloe Vera Gel untuk Kecantikan,
"Serial India Baru ANTV, Ini rating ‘Mahakaali’ dan ‘Takdir Lonceng Cinta’",
"Lamarannya Ditolak, Mas Pur Pingsan di ‘Tukang Ojek Pengkolan’",
"Menderita Batu Ginjal, Aly Goni Masuk Rumah Sakit",
‘Tercyduk’ SCTV Asli Atau Settingan? Begini Jawaban Lionil Hendrik,
"Serial India Baru ANTV, Ini rating ‘Mahakaali’ dan ‘Takdir Lonceng Cinta’",
"Lamarannya Ditolak, Mas Pur Pingsan di ‘Tukang Ojek Pengkolan’",
"Menderita Batu Ginjal, Aly Goni Masuk Rumah Sakit",
‘Tercyduk’ SCTV Asli Atau Settingan? Begini Jawaban Lionil Hendrik,
Serial Tokusatsu ‘Legend Hero’ akan Tayang di RTV,
"Yuk, Kenalan Sama Pemain & Karakter ‘APACE, Anak Punk Anti Cewek’ RCTI",
Serial Tokusatsu ‘Legend Hero’ akan Tayang di RTV,
"Yuk, Kenalan Sama Pemain & Karakter ‘APACE, Anak Punk Anti Cewek’ RCTI",
"Pindah Jam Tayang, ‘Hafizah’ Masuki Episode Terakhir di RCTI",
Amanda Manopo Bocorkan Perannya di Sinetron ‘Ada Dua Cinta’,
"Pindah Jam Tayang, ‘Hafizah’ Masuki Episode Terakhir di RCTI",
"Dipandu Harry Pantja, ‘Gerbang Dunia Lain’ Segera Tayang di Trans TV",
Ini yang Terjadi pada Kulit Kalau Kamu Tidur Masih Pakai Makeup,
"Syuting Lagi, Ammar Zoni Akui Sempat Grogi di Depan Kamera",
"Sinopsis ‘Dia yang Tak Terlihat’, Kisah Cinta Berbalut Misteri Pembunuhan",
Dua Adegan Ini Bikin ‘Orang Ketiga’ Kena Tegur KPI,
Alasan Kenapa ‘Meteor Garden’ 2018 Tampil Beda dan Lebih ‘Unyu’,
"Sinopsis ‘Dia yang Tak Terlihat’, Kisah Cinta Berbalut Misteri Pembunuhan",
"Mirip ‘Putri yang Ditukar’, Begini Sinopsis ‘Ada Dua Cinta’ RCTI",
"Mirip ‘Putri yang Ditukar’, Begini Sinopsis ‘Ada Dua Cinta’ RCTI",
"‘Pesbukers’ Balik ke Slot Sore, ‘Dil Se Dil Tak’ Dibungkus ANTV?",
"‘Pesbukers’ Balik ke Slot Sore, ‘Dil Se Dil Tak’ Dibungkus ANTV?",
"Muncul di ‘STJC’, Meriam Bellina Ibu Kandung Natasha Wilona?",iyaa.com | Jakarta: Meriam Bellina jadi pendatang baru di sinetron Siapa Takut Jatuh Cinta SCTV....
"Ada Kolaborasi Milenial, Ini Daftar Lagu di Top 5 ‘Indonesian Idol’","iyaa.com | Jakarta: Lima kontestan masih bertahan di ajang Indonesian Idol 2018. Abdul, Joan, Ghea,..."
"Edward Masih Hidup, Raihan Khan Dinanti Fans ‘Dunia Terbalik’",iyaa.com | Jakarta: Sinetron Dunia Terbalik RCTI kembali dibuat gempar dengan hadirnya sosok yang disebut...
"Gantikan ‘Ummi’, ‘Oh Mama, Oh Papa…’ Tayang Lagi di ANTV","iyaa.com | Jakarta: Sinetron Ummi masuki episode terakhirnya hari ini, Senin (19/3/2018). Sebagai penggantinya, ANTV..."
"LIDA Top 27: Nando Diselamatkan Dewan Dangdut, Ruly Tersingkir",iyaa.com | Jakarta: Satu dari empat duta dangdut Grup 5 harus tersingkir dari panggung Liga...
"Elly Sugigi Minta Maaf, ‘Pesbukers’ Ketahuan Settingan, Ini Respon Netizen",iyaa.com | Jakarta: Tak lama setelah Komisi Penyiaran Indonesia (KPI) mengeluarkan surat peringatan untuk Pesbukers...
"‘Ummi’ Tamat di ANTV, Ridwan Ghany Cs Pamitan","iyaa.com | Jakarta: Sinetron Ummi masuki episode terakhirnya pagi ini, Senin 19 Maret 2018 di..."
Lavina Tandon ‘Jodha Akbar’ Muncul di ‘Chandra Nandini’ ANTV,iyaa.com | Jakarta: Masih ingat dengan wajah cantik Lavina Tandon di serial Jodha Akbar? Penggemar...
"MNCTV Gelar Meet and Greet ‘Rindu Bilang Sayang’, Catat Jadwalnya",iyaa.com | Jakarta: Di akhir pekan ini ada kejutan seru buat pemirsa MNCTV khususnya penggemar...
"‘Karma’ ANTV Dituduh Settingan, Robby Purba Tantang Haters",iyaa.com | Jakarta: Program Karma ANTV dituduh settingan. Beragam kisah mistis dari para partisipan disebut...
"Pakai Hot Pants dan Kaos Ketat, Ashanty Banjir Protes Netizen",
4 Mitos dan Fakta Seputar Aloe Vera Gel untuk Kecantikan,
"Serial India Baru ANTV, Ini rating ‘Mahakaali’ dan ‘Takdir Lonceng Cinta’",
"Lamarannya Ditolak, Mas Pur Pingsan di ‘Tukang Ojek Pengkolan’",
"Menderita Batu Ginjal, Aly Goni Masuk Rumah Sakit",
‘Tercyduk’ SCTV Asli Atau Settingan? Begini Jawaban Lionil Hendrik,
Serial Tokusatsu ‘Legend Hero’ akan Tayang di RTV,
"Yuk, Kenalan Sama Pemain & Karakter ‘APACE, Anak Punk Anti Cewek’ RCTI",
"Pindah Jam Tayang, ‘Hafizah’ Masuki Episode Terakhir di RCTI",
"Samuel Zylgwyn Nangis di ‘Orang Ketiga’, Fans: Sedihnya Cowok Banget",
"Jangan Tergiur Iklan, Pilih Skincare yang Tepat Lewat Komposisinya",
Vivek Dahiya Antusias Bintangi Serial Fantasy Thriller ‘Qayamat Ki Raat’,
"Sinopsis ‘Dia yang Tak Terlihat’, Kisah Cinta Berbalut Misteri Pembunuhan",
"Mirip ‘Putri yang Ditukar’, Begini Sinopsis ‘Ada Dua Cinta’ RCTI",
"‘Pesbukers’ Balik ke Slot Sore, ‘Dil Se Dil Tak’ Dibungkus ANTV?",
"Masih Cantik di Usia 40-an, Ternyata Ini Rahasia Angelina Jolie","iyaa.com | Jakarta: Siapa yang tidak mengenal Angelina Jolie, aktris cantik yang terkenal dengan bibir..."
"6 Lipstik Ini Punya Warna Gak Biasa, Berani Coba?","iyaa.com | Jakarta: Inovasi-inovasi baru selalu hadir dalam produk kosmetik, salah satunya lipstik. Belakangan ini..."
4 Cara Mudah Aplikasikan Makeup Tanpa Brush,"iyaa.com | Jakarta: Berapa banyak brush yang kamu miliki di rumah? Brush ada beragam jenisnya,..."
6 Kegunaan Sikat Gigi dalam Rutinitas Kecantikanmu,iyaa.com | Jakarta: Sikat gigi tentunya kamu gunakan untuk menyikat gigi bukan. Tapi ternyata sikat...
5 Tips Mudah Dapatkan Bibir yang Indah,"iyaa.com | Jakarta: Bibir jadi bagian tubuh yang sering jadi pusat perhatian. Oleh karena itu,..."
"Usai ‘Catatan Harian Aisha’, Umay Shahab Siapkan ‘Roman Picisan’ The Movie","iyaa.com | Jakarta: Setelah sinetron Catatan Harian Aisha tamat di RCTI, Umay Shahab kembali bergabung..."
Manfaat Bunga Kaktus untuk Kecantikan,"iyaa.com | Jakarta: Sudah banyak produk kecantikan yang berbahan dasar aloe vera, jojoba oil, gingseng,..."
"Ditanya Kriteria Jodoh, Kriss Hatta ‘Mr. Money’ Beri Jawaban Kocak","iyaa.com | Jakarta: Sejak memandu reality show Uang Kaget, Kriss Hatta tampaknya makin banyak yang..."
Doni Permana ‘Ekspedisi Merah’ Cover Lagu ‘Kasih Jangan Kau Pergi’,"iyaa.com | Jakarta: Doni Permana, personil tim 2 Ekspedisi Merah jajal peruntungannya di dunia tarik..."
"Sebelum Beli Makeup, Yuk Cari Tahu Tone Kulit Kamu",iyaa.com | Jakarta: Setiap hari selalu muncul produk makeup terbaru. Apalagi kalau kamu melihat temanmu...
"Kamu Penggemar Disney, Kamu Wajib Punya Bath Bomb Ini","iyaa.com | Jakarta: Kamu pasti pernah mendengar bath bomb bukan, si aksesoris mandi yang belakangan..."
6 Warna Lipstik Ini Cocok Kamu Kenakan dengan Baju Biru,iyaa.com | Jakarta: Warna biru merupakan warna yang menunjukkan perasaan hangat sekaligus bersemangat. Sayangnya agak...
"Dipanggil ‘Babang Tamvan’, Ini Perasaan Andika Kangen Band",iyaa.com | Jakarta: Andika Maesa atau Andika Kangen Band dijuluki sebagai “Babang Tamvan”. Musisi Indonesia...
"Jadi Model Video Klip, Siddharth Nigam Makin Ganteng","iyaa.com | New Delhi: Di bulan Maret ini, Siddharth Nigam punya sesuatu yang baru buat..."
‘Shani’ Jadi Hadiah Ultah Terindah Buat Kartikey Malviya,iyaa.com | New Delhi: Serial Shani (Karmaphal Daata Shani) tayang sejak Selasa (6/3/2018) di ANTV....
"Tipe Cowok Idaman Ersya Aurelia, Bukan yang Romantis!",iyaa.com | Jakarta: Ersya Aurelia kini identik dengan sosok Dara yang feminim dan lembut dalam...
"Faisal Khan Balik ke Indonesia, Ada Meet and Greet di Kudus","iyaa.com | Jakarta: Sempat beberapa kali datang ke Indonesia, hadirnya kembali Faisal Khan di tanah..."
"Takut Kosmetik Kamu Berantakan Saat Travelling, Ikuti 5 Tips Ini!",iyaa.com | Jakarta: Travelling tentu saja kegiatan yang menyenangkan bagi banyak orang. Kamu dapat berkunjung...
"Pakai Hot Pants dan Kaos Ketat, Ashanty Banjir Protes Netizen",
4 Mitos dan Fakta Seputar Aloe Vera Gel untuk Kecantikan,
"Serial India Baru ANTV, Ini rating ‘Mahakaali’ dan ‘Takdir Lonceng Cinta’",
"Lamarannya Ditolak, Mas Pur Pingsan di ‘Tukang Ojek Pengkolan’",
"Kocak, Ini Pengakuan Polos Bianca Jodie Saat Bertemu Aliando Syarief","iyaa.com | Jakarta: Bianca Jodie mengungkap perasaannya setelah bertemu sang idola, Aliando Syarief. Berdasarkan pengakuannya,..."
"Foto Bareng Aliando Syarief, Bianca Jodie Disangka Prilly Latuconsina",iyaa.com | Jakarta: Bianca Jodie berhasil wujudkan impian lainnya setelah keluar dari Indonesian Idol 2018....
"Pakai Hot Pants dan Kaos Ketat, Ashanty Banjir Protes Netizen",
4 Mitos dan Fakta Seputar Aloe Vera Gel untuk Kecantikan,
"Serial India Baru ANTV, Ini rating ‘Mahakaali’ dan ‘Takdir Lonceng Cinta’",
"Menderita Batu Ginjal, Aly Goni Masuk Rumah Sakit",
‘Tercyduk’ SCTV Asli Atau Settingan? Begini Jawaban Lionil Hendrik,
Serial Tokusatsu ‘Legend Hero’ akan Tayang di RTV,
"Yuk, Kenalan Sama Pemain & Karakter ‘APACE, Anak Punk Anti Cewek’ RCTI",
"Lamarannya Ditolak, Mas Pur Pingsan di ‘Tukang Ojek Pengkolan’",
"Menderita Batu Ginjal, Aly Goni Masuk Rumah Sakit",
‘Tercyduk’ SCTV Asli Atau Settingan? Begini Jawaban Lionil Hendrik,
Serial Tokusatsu ‘Legend Hero’ akan Tayang di RTV,
"Yuk, Kenalan Sama Pemain & Karakter ‘APACE, Anak Punk Anti Cewek’ RCTI",
"Pindah Jam Tayang, ‘Hafizah’ Masuki Episode Terakhir di RCTI",
"Ranty Maria Absen Sementara, Sosok Wanita Ini Muncul di ‘Anak Langit’",
"Pamer Kemesraan Bareng Verrell, Natasha Wilona Bikin Syok Netizen",
Ammar Zoni Hajar Seorang Pria Karena Buang Sampah Sembarangan,
"Pindah Jam Tayang, ‘Hafizah’ Masuki Episode Terakhir di RCTI",
"Cobain Yuk ‘Google Picks My Makeup Challenge’, Tren Challenge Baru untuk Para Pecinta Makeup",
"Powder Puff Lippie, Lip Cream dengan Aplikator Unik dari NYX",
"Sinopsis ‘Dia yang Tak Terlihat’, Kisah Cinta Berbalut Misteri Pembunuhan",
"Mirip ‘Putri yang Ditukar’, Begini Sinopsis ‘Ada Dua Cinta’ RCTI",
"‘Pesbukers’ Balik ke Slot Sore, ‘Dil Se Dil Tak’ Dibungkus ANTV?",
Indonesian Idol Top 10: Chandra Banyak Salah Lirik,
"Sinopsis ‘Dia yang Tak Terlihat’, Kisah Cinta Berbalut Misteri Pembunuhan",
"Mirip ‘Putri yang Ditukar’, Begini Sinopsis ‘Ada Dua Cinta’ RCTI",
"‘Pesbukers’ Balik ke Slot Sore, ‘Dil Se Dil Tak’ Dibungkus ANTV?",
"Tayang Perdana, ‘Mahluk Manis Dalam Bis’ Dikritik Netizen","iyaa.com | Jakarta: Gantikan Sodrun Merayu Tuhan, sinetron Mahluk Manis Dalam Bis tayang perdana kemarin,..."
"Meriam Bellina Gabung ‘Siapa Takut Jatuh Cinta’, Jadi Siapa?",iyaa.com | Jakarta: Sinetron Siapa Takut Jatuh Cinta SCTV kembali kedatangan pemain baru. Aktris senior...
‘Jodoh Wasiat Bapak’ Diperingatkan KPI Gara-Gara Hantu Seram,iyaa.com | Jakarta: Sinetron Jodoh Wasiat Bapak mendapat peringatan tertulis dari Komisi Penyiaran Indonesia (KPI)....
"Elly Sugigi Ngomong Kasar, ‘Pesbukers’ Ditegur KPI","iyaa.com | Jakarta: Pesbukers ANTV kembali ditegur Komisi Penyiaran Indonesia (KPI). Kali ini, KPI menyoroti..."
KPI Peringatkan ‘Karma The Series’ ANTV Gara-Gara Adegan KDRT,iyaa.com | Jakarta: Komisi Penyiaran Indonesia (KPI) kembali layangkan surat peringatan tertulis untuk beberapa program...
"LIDA Top 27: Bikin Juri Kagum, Selfi Disebut Calon Juara","iyaa.com | Jakarta: Pada Kamis (15/3/2018), tampil para duta dangdut Liga Dangdut Indonesia (LIDA) dari..."
"Bareng Rezky Aditya, Omar Daniel Gabung Sinetron Baru Cut Syifa","iyaa.com | Jakarta: Setelah Putri yang Ditukar beberapa tahun lalu, Cut Syifa kembali bermain sinetron..."
"Ayu Ting Ting Dibanting Hingga Memar, Fans Minta Klarifikasi ‘Brownis’","iyaa.com | Jakarta: Program Brownis (Obrowlan Manis) Trans TV kembali jadi sorotan publik. Kali ini,..."
"Jadi Antagonis, Begini Jahatnya Cut Meyriska di Teaser ‘Cinta Kedua’",iyaa.com | Jakarta: Sinetron baru tengah disiapkan SCTV untuk pemirsa setianya berjudul Cinta Kedua. Di...
"LIDA Top 27: Tampil Keren, Tiga Duta Dangdut Dapat Standing Ovation",iyaa.com | Jakarta: Konser Top 27 Liga Dangdut Indonesia (LIDA) telah dimulai pada Rabu (14/3/2018)....
"Pakai Hot Pants dan Kaos Ketat, Ashanty Banjir Protes Netizen",
4 Mitos dan Fakta Seputar Aloe Vera Gel untuk Kecantikan,
"Serial India Baru ANTV, Ini rating ‘Mahakaali’ dan ‘Takdir Lonceng Cinta’",
"Lamarannya Ditolak, Mas Pur Pingsan di ‘Tukang Ojek Pengkolan’",
"Menderita Batu Ginjal, Aly Goni Masuk Rumah Sakit",
‘Tercyduk’ SCTV Asli Atau Settingan? Begini Jawaban Lionil Hendrik,
Serial Tokusatsu ‘Legend Hero’ akan Tayang di RTV,
"Yuk, Kenalan Sama Pemain & Karakter ‘APACE, Anak Punk Anti Cewek’ RCTI",
"Pindah Jam Tayang, ‘Hafizah’ Masuki Episode Terakhir di RCTI",
Romantisnya Shakti Arora dan Aditi Sharma di Episode Perdana ‘Silsila’,
"Rahasia Di Balik Kacamata Hitam Syahrini, Makeup Item Ini Wajib Ada",
"Cobain Yuk ‘Google Picks My Makeup Challenge’, Tren Challenge Baru untuk Para Pecinta Makeup",
"Sinopsis ‘Dia yang Tak Terlihat’, Kisah Cinta Berbalut Misteri Pembunuhan",
"Mirip ‘Putri yang Ditukar’, Begini Sinopsis ‘Ada Dua Cinta’ RCTI",
"‘Pesbukers’ Balik ke Slot Sore, ‘Dil Se Dil Tak’ Dibungkus ANTV?",
"Jawaban Ersya Aurelia Jika Bryan Domani Nyatakan Perasaan, Ternyata…",iyaa.com | Jakarta: Ersya Aurelia dan Bryan Domani jadi pasangan idola dalam sinetron Siapa Takut...
Tips Makeup untuk Kamu yang Bertubuh Plus Size,iyaa.com | Jakarta: Semua perempuan itu cantik. Namun dengan banyaknya iklan yang menggunakan perempuan bertubuh...
"Murah Meriah, 3 Benda Ini Dipakai Seleb untuk Tips Kecantikannya",iyaa.com | Jakarta: Seorang selebriti biasanya dituntut untuk selalu tampil cantik dimana pun dan kapan...
"Berterima Kasih pada Arjuna, Shaheer Sheikh Curhat di Instagram",iyaa.com | New Delhi: Sosok Shaheer Sheikh tak lepas dari karakter Arjuna yang diperankannya di...
Eza Gionino Masih Cocok Jadi Anak SMA di ‘Rindu Bilang Sayang’,iyaa.com | Jakarta: Eza Gionino muncul lagi di layar kaca dalam sebuah sinetron berjudul Rindu...
6 Warna Lipstik Yang Wajib Dimiliki Anak Muda,"iyaa.com | Jakarta: Lipstik adalah alat makeup wajib bagi perempuan, mulai dari yang hobi dandan..."
"Bubi Bubi Lip, Solusi Mudah Melakukan Scrub Bibir Sendiri","iyaa.com | Jakarta: Inovasi dalam produk perawatan bibir terus bermunculan, seperti lip stain, lip cream,..."
"Strawberry, Buah Kecil yang Punya Manfaat Besar untuk Kecantikan","iyaa.com | Jakarta: Strawbberry, buah berwarna merah dengan rasa manis atau kecut ini mempunyai beragam..."
"Tereliminasi di ‘Indonesian Idol 2018’, Ini Pesan Glen untuk Jodie",iyaa.com | Jakarta: Bianca Jodie telah tereliminasi dari panggung Indonesian Idol 2018. Ia harus meninggalkan...
"Album Barunya Puncaki Chart i-Tunes, Shane Filan: Terima Kasih Indonesia","iyaa.com | Jakarta: Shane Filan kembali datang ke Indonesia untuk promo album terbarunya, Love Always...."
Rekomendasi Bedak Tabur untuk Si Pemilik Kulit Berminyak,iyaa.com | Jakarta: Setiap perempuan pasti ingin tampil dengan kulit wajah yang mulus tanpa noda....
"Drashti Dhami ‘Pardes’ Bagikan Rahasia Kecantikannya, Apa Saja?","iyaa.com | Mumbai: Siapa yang tidak terpesona dengan kecantikan Drashti Dhami, si pemeran Naina di..."
"Simpel Banget, Begini Cara Bikin Lip Balm Sendiri dengan Coconut Oil","iyaa.com | Jakarta: Seiring menjamurnya berbagai produk kecantikan untuk bibir, masalah pada bibir pun banyak..."
"Balas Posting Selfie Bareng Maia Estianty, Ini Kata Shane Filan","iyaa.com | Jakarta: Shane Filan balas memposting foto selfie bersama Maia Estianty. Dalam captionnya, Shane..."
"Irish Bella Beri Selamat, Elly Sugigi Sudah Nikah Lagi?",iyaa.com | Jakarta: Elly Sugigi dan Irish Bella kerap bertemu dalam satu sinetron. Elly Sugigi...
Ini Loh yang Dicari Shane Filan Saat Datang ke Indonesia!,"iyaa.com | Jakarta: Kembali gelar konser di Surabaya pada Minggu (4/3/2018), Shane Filan menganggap Indonesia..."
Pentingnya Essence dalam Perawatan Kulit Harian Kamu,iyaa.com | Jakarta: Rahasia kecantikan khas perempuan Asia seakan jadi topik yang tak ada habisnya...
"Fanbo Siap Luncurkan Beauty Blender, Desainnya Imut Banget!","iyaa.com | Jakarta: Brand asal lokal, Fanbo Cosmetics, siap merilis produk terbarunya yaitu Fanbo Perfect..."
"Pemain ‘Orang Ketiga’ Bikin Video Boomerang, Gaya Samuel Zylgwyn Beda Sendiri","iyaa.com | Jakarta: Meski di layar kaca saling berkonflik, di luar syuting para pemain Orang..."
"Diserang Fans Jodie ‘Idol’, Ini Jawaban Maia Estianty","iyaa.com | Jakarta: Sususl Glen, Bianca Jodie ikut tereliminasi di babak Spektakuler Show 7 Indonesian..."
"Pakai Hot Pants dan Kaos Ketat, Ashanty Banjir Protes Netizen",
"Pakai Hot Pants dan Kaos Ketat, Ashanty Banjir Protes Netizen",
4 Mitos dan Fakta Seputar Aloe Vera Gel untuk Kecantikan,
"Serial India Baru ANTV, Ini rating ‘Mahakaali’ dan ‘Takdir Lonceng Cinta’",
4 Mitos dan Fakta Seputar Aloe Vera Gel untuk Kecantikan,
"Serial India Baru ANTV, Ini rating ‘Mahakaali’ dan ‘Takdir Lonceng Cinta’",
"Lamarannya Ditolak, Mas Pur Pingsan di ‘Tukang Ojek Pengkolan’",
"Lamarannya Ditolak, Mas Pur Pingsan di ‘Tukang Ojek Pengkolan’",
"Menderita Batu Ginjal, Aly Goni Masuk Rumah Sakit",
‘Tercyduk’ SCTV Asli Atau Settingan? Begini Jawaban Lionil Hendrik,
"Menderita Batu Ginjal, Aly Goni Masuk Rumah Sakit",
‘Tercyduk’ SCTV Asli Atau Settingan? Begini Jawaban Lionil Hendrik,
Serial Tokusatsu ‘Legend Hero’ akan Tayang di RTV,
"Yuk, Kenalan Sama Pemain & Karakter ‘APACE, Anak Punk Anti Cewek’ RCTI",
Serial Tokusatsu ‘Legend Hero’ akan Tayang di RTV,
"Yuk, Kenalan Sama Pemain & Karakter ‘APACE, Anak Punk Anti Cewek’ RCTI",
Roy Kiyoshi Pastikan ‘Karma’ ANTV Bukan Settingan,"iyaa.com | Jakarta: Sukses jadi program reality show unggulan di ANTV, program Karma Show sempat..."
Intip Bocoran Cerita ‘Ada Dua Cinta’ Dibintangi Amanda Manopo – Syifa Hadju,"iyaa.com | Jakarta: Amanda Manopo dan Syifa Hadju kembali bertemu dalam sinetron terbaru RCTI, Ada..."
"Pindah Jam Tayang, ‘Hafizah’ Masuki Episode Terakhir di RCTI",
Shraddha Arya dan Manit Joura ‘Kundali Bhagya’ Antusias Tiba di Indonesia,
"Bintangi ‘Qayamat Ki Raat’, Penampilan Nirbhay Wadhwa Serem Banget",
"Pindah Jam Tayang, ‘Hafizah’ Masuki Episode Terakhir di RCTI",
"Ini Alasan Produk Kecantikan Diuji Coba ke Hewan, Ternyata…",
"‘Sodrun Merayu Tuhan’ Tamat, Cut Syifa – Nikita Willy Siapkan Sinetron Baru SCTV","iyaa.com | Jakarta: Sinetron Sodrun Merayu Tuhan tamat sore ini, Rabu (14/3/2018) di SCTV. Segenap..."
"Tak Pakai Helm Saat Berkendara, ‘Dunia Terbalik’ Diadukan ke Polantas & KPI","iyaa.com | Jakarta: Sempat dipuji dan banjir penghargaan, sinetron Dunia Terbalik RCTI kini banjir protes..."
"LIDA Masuki Babak Top 27, Ini Pembagian Grupnya",iyaa.com | Jakarta: Liga Dangdut Indonesia (LIDA) telah selesai menggelar babak 34 besar. Sebanyak 27...
LIDA Top 34: Gilang dari Papua Barat Keluar dari Grup 6,
"Sinopsis ‘Dia yang Tak Terlihat’, Kisah Cinta Berbalut Misteri Pembunuhan",
"Mirip ‘Putri yang Ditukar’, Begini Sinopsis ‘Ada Dua Cinta’ RCTI",
"Marshanda – Naysilla Mirdad Foto Bareng, Topi ‘Mas Aris’ Curi Perhatian",
Begini Perjuangan Nasya Marcella Demi ‘Anak Langit’,
"Sinopsis ‘Dia yang Tak Terlihat’, Kisah Cinta Berbalut Misteri Pembunuhan",
"LIDA Top 34: Jono Lolos, Azmin Gagal ke Babak 27 Besar",iyaa.com | Jakarta: Babak Top 34 Liga Dangdut Indonesia ditutup dengan penampilan para duta dangdut...
"Tayang Sore Hari, Begini Rating Perdana Serial India ‘Dil Se Dil Tak’",iyaa.com | Jakarta: Serial India baru Dil Se Dil Tak telah hadir di ANTV pada...
"‘Pesbukers’ Balik ke Slot Sore, ‘Dil Se Dil Tak’ Dibungkus ANTV?",
"Mirip ‘Putri yang Ditukar’, Begini Sinopsis ‘Ada Dua Cinta’ RCTI",
"‘Pesbukers’ Balik ke Slot Sore, ‘Dil Se Dil Tak’ Dibungkus ANTV?",
"Gantikan ‘Sodrun Merayu Tuhan’, Ini Jadwal Tayang ‘Mahluk Manis Dalam Bis’ SCTV",iyaa.com | Jakarta: Sinetron Sodrun Merayu Tuhan masuki episode-episode terakhirnya di SCTV. Sinetron yang dibintangi...
"Yeay, Raihan Khan Alias Edward Muncul Lagi di ‘Dunia Terbalik’!",iyaa.com | Jakarta: Sosok Edward lama menghilang di sinetron Dunia Terbalik RCTI. Menghilangnya Edward yang...
"‘The Next Boy/Girl Band’ Salah Tulis Pencipta Lagu, Ini Klarifikasi GTV",iyaa.com | Jakarta: Program The Next Boy/Girl Band di GTV mendapat protes dari Badai. Pasalnya...
"Pakai Hot Pants dan Kaos Ketat, Ashanty Banjir Protes Netizen",
4 Mitos dan Fakta Seputar Aloe Vera Gel untuk Kecantikan,
"Serial India Baru ANTV, Ini rating ‘Mahakaali’ dan ‘Takdir Lonceng Cinta’",
"Lamarannya Ditolak, Mas Pur Pingsan di ‘Tukang Ojek Pengkolan’",
"Menderita Batu Ginjal, Aly Goni Masuk Rumah Sakit",
‘Tercyduk’ SCTV Asli Atau Settingan? Begini Jawaban Lionil Hendrik,
Serial Tokusatsu ‘Legend Hero’ akan Tayang di RTV,
"Yuk, Kenalan Sama Pemain & Karakter ‘APACE, Anak Punk Anti Cewek’ RCTI",
"Pindah Jam Tayang, ‘Hafizah’ Masuki Episode Terakhir di RCTI",
Kriss Hatta Tak Menyesal Jadi Mualaf karena Hilda Vitria,
"Posting Parodi ‘Karma’ di MNCTV, Petinggi ANTV Sindir Raffi Ahmad",
"Rating Perdana ‘Hafizah’ RCTI, ‘Catatan Harian Aisha’ Menurun Drastis",
"Sinopsis ‘Dia yang Tak Terlihat’, Kisah Cinta Berbalut Misteri Pembunuhan",
"Mirip ‘Putri yang Ditukar’, Begini Sinopsis ‘Ada Dua Cinta’ RCTI",
"‘Pesbukers’ Balik ke Slot Sore, ‘Dil Se Dil Tak’ Dibungkus ANTV?",
3 Brand Lipstik Ini Tunjukkan Kepedulian di Hari Perempuan Internasional,iyaa.com | Jakarta: Berbagai cara dapat dilakukan untuk memperingati Hari Perempuan Internasional. Misalnya yang dilakukan...
"Cantiknya Khas, Ini Rahasia Kecantikan Aditi Bhatia ‘Mohabbatein’","iyaa.com | Mumbai: Siapa yang tidak terpesona kecantikan Aditi Bhatia, si pemeran Ruhi di serial..."
"Mempesona Dengan Lipstik Ungu, Ikuti 4 Tips Ini!",iyaa.com | Jakarta: Lipstik merupakan item yang wajib dimiliki perempuan. Itu sebabnya banyak produsen kosmetik...
"Lip Tint, Lip Cream, Lip Stain, Bedanya Apa?",iyaa.com | Jakarta: Bibir jadi salah satu bagian tubuh kaum hawa yang wajib kena sentuhan...
"Pakai Hot Pants dan Kaos Ketat, Ashanty Banjir Protes Netizen",
4 Mitos dan Fakta Seputar Aloe Vera Gel untuk Kecantikan,
"Serial India Baru ANTV, Ini rating ‘Mahakaali’ dan ‘Takdir Lonceng Cinta’",
"Lamarannya Ditolak, Mas Pur Pingsan di ‘Tukang Ojek Pengkolan’",
"Menderita Batu Ginjal, Aly Goni Masuk Rumah Sakit",
‘Tercyduk’ SCTV Asli Atau Settingan? Begini Jawaban Lionil Hendrik,
Serial Tokusatsu ‘Legend Hero’ akan Tayang di RTV,
"Yuk, Kenalan Sama Pemain & Karakter ‘APACE, Anak Punk Anti Cewek’ RCTI",
"Pindah Jam Tayang, ‘Hafizah’ Masuki Episode Terakhir di RCTI",
"Pemain ‘Chandra Nandini’ Sapa Penggemar, Janji Bakal ke Indonesia",
Marshanda Curhat Soal Di-bully Karena Peran Pelakor di ‘Orang Ketiga’,
"5 Program TV Ramadan Terancam Dibubarkan KPI, Netizen: Semoga Terkabul",
"Sinopsis ‘Dia yang Tak Terlihat’, Kisah Cinta Berbalut Misteri Pembunuhan",
"Mirip ‘Putri yang Ditukar’, Begini Sinopsis ‘Ada Dua Cinta’ RCTI",
"‘Pesbukers’ Balik ke Slot Sore, ‘Dil Se Dil Tak’ Dibungkus ANTV?",
Kartikey Malviya Aktor Muda Pemeran ‘Shani’,"iyaa.com | Jakarta: Mulai hari ini, Selasa (6/3/2018), ANTV akan menayangkan serial baru berjudul Shani..."
