judul,deskripsi
"Sinopsis ‘Takdir Lonceng Cinta’, Ini Awal Mula Kisah Keluarga Pragya","iyaa.com | Jakarta: Serial spin off Lonceng Cinta, Kundali Bhagya, akan tayang perdana di ANTV...."
"‘Mahakaali’ Tayang Perdana, Begini Kisah Pooja Sharma sebagai Dewi Parwati",iyaa.com | Jakarta: Serial Mahakali yang dibintangi Pooja Sharma dan Saurabh Raj Jain tayang perdana...
"Serial India Baru ANTV, Ini rating ‘Mahakaali’ dan ‘Takdir Lonceng Cinta’",iyaa.com | Jakarta: Dua serial India baru ditayangkan ANTV pekan ini: Mahakaali dan Takdir Lonceng...
"Menderita Batu Ginjal, Aly Goni Masuk Rumah Sakit",iyaa.com | New Delhi: Aly Goni yang dikenal pemirsa Mohabbatein sebagai Romi saat ini sedang...
"‘Seleb’ Tayang Perdana di SCTV, Ini Sinopsis dan Nama Pemainnya","iyaa.com | Jakarta: Sinetron Ramadan SCTV, Tiada Hari yang Tak Indah tamat kemarin (20/6/2018). Sebagai..."
"Lamarannya Ditolak, Mas Pur Pingsan di ‘Tukang Ojek Pengkolan’",iyaa.com | Jakarta: Kisah cinta Furry Setya kembali berujung menyedihkan. Lamaran Purnomo alias Mas Pur...
"Jasmin Bhasin ‘Dil Se Dil Tak’ Ultah, Siap Kembali ke TV dengan Proyek Baru","iyaa.com | New Delhi: Aktris Dil Se Dil Tak, Jasmin Bhasin, berulang tahun kemarin, Kamis..."
"Bintangi Serial Detektif ‘Dev 2’, Jigyasa Singh Sempat Merasa Overacting",iyaa.com | New Delhi: Si bintang Thapki Jigyasa Singh saat ini bermain di serial Detektif...
"Dibintangi Elina Joerg, ‘Kisah Misteri’ Tayang Perdana di RCTI","iyaa.com | Jakarta: Mulai malam ini, Rabu (20/6/2018), RCTI menghadirkan sinetron baru Kisah Misteri. Sesuai..."
"Sinopsis ‘Pengorbanan Cinta’, Kisah Menantu Cerdas VS Mertua Galak di SCTV",iyaa.com | Jakarta: Serial India Pengorbanan Cinta (Mere Angne Mein) tayang lagi di SCTV. Serial...
4 Mitos dan Fakta Seputar Aloe Vera Gel untuk Kecantikan,"iyaa.com | Jakarta: Aloe vera (lidah buaya), tanaman yang satu ini dipercaya punya banyak manfaat..."
"Manfaat Argan Oil untuk Wajah, dari Kulit Mulus Hingga Sembuhkan Jerawat",iyaa.com | Jakarta: Beragam jenis face oil kini diburu beauty enthusiast. Face oil jadi salah...
"Pakai Hot Pants dan Kaos Ketat, Ashanty Banjir Protes Netizen","iyaa.com | Jakarta: Posting foto liburannya di Disneyland, California, Ashanty tampil seksi dengan hot pants..."
Begini Alasan Meghan Markle Selalu Pakai Sepatu Kebesaran,iyaa.com | Jakarta: Ada satu hal menarik tentang alas kaki Meghan Markle. Dari foto di...
"‘GOST- Gosipin Setan’, Kisah Horor Selebriti di Trans TV",iyaa.com | Jakarta: Trans TV siapkan sederet program horor dan misteri. Tak hanya Gerbang Dunia...
"‘Girl’s Diary’, Petualangan Seru Dinda Kirana Jadi Traveler Segera di Trans TV",iyaa.com | Jakarta: Dinda Kirana siap ceritakan petualangannya di program baru Trans TV berjudul Girl’s...
"Trans 7 Raih Gelar Televisi Syiar Ramadhan 2018, Ini Harapan Netizen",iyaa.com | Jakarta: Ajang penghargaan Anugerah Syiar Ramadhan 1439 H/2018 M diselenggarakan Komisi Penyiaran Indonesia...
"Lahir di Jakarta, Caesar Hito Baru Pertama Kali Jalan-jalan ke Monas?",iyaa.com | Jakarta: Immanuel Caesar Hito mengungkap hal mengejutkan dalam dirinya. Pemeran Andra dalam sinetron...
"Ada Jumpa Fans ‘Anak langit’ dan ‘STJC’, Stefan William – Natasha Wilona Reuni?","iyaa.com | Jakarta: SCTV kembali menggelar meet and greet atau jumpa fans. Tak tanggung-tanggung, SCTV..."
"Kasihan, Drashti Dhami Alami KDRT di ‘Silsila’",iyaa.com | Jakarta: Silsila Badalte Rishton Ka baru tayang pekan ini di Colors TV (India)....
Romantisnya Shakti Arora dan Aditi Sharma di Episode Perdana ‘Silsila’,iyaa.com | Jakarta: Serial Silsila Badalte Rishton Ka tayang perdana Senin (4/6/2018) di Colors TV....
"Serial Turki ‘Air Mata Anakku’, Kisah Haru Ayah dan Kelima Putrinya","iyaa.com | Jakarta: Lama tak tayang, serial Turki kembali hadir di RCTI. Berjudul Air Mata..."
3 Cara Memanfaatkan Semangka untuk Kulit Cantik Alami,"iyaa.com | Jakarta: Semangka tak hanya menyehatkan tubuh, namun juga bermanfaat untuk kecantikan kulit. Sebab..."
"Muncul dengan Rambut Gondrong, Aliando Syarief Tuai Pro – Kontra",iyaa.com | Jakarta: Aliando Syarief menghilang di dunia hiburan tanah air setelah memutuskan keluar dari...
"Dab, Tap, Rub, atau Pat? Mana Cara Terbaik untuk Mengaplikasikan Pelembap?",iyaa.com | Jakarta: Pelembap merupakan salah satu produk kecantikan yang sering dipakai perempuan. Tapi bagaimana...
"Bareng Vogue, Kylie Jenner Bagikan Detil Makeup Andalannya…Buruan Contek!",iyaa.com | Jakarta: Majalah Vogue selalu menggandeng selebriti untuk membagikan beauty secrets mereka. Kali ini...
"Pakai Dress Ini, Ayu Ting Ting Disandingkan dengan Kate Middleton",iyaa.com | Jakarta: Gaya busana Ayu Ting Ting kembali jadi sorotan netizen. Ayu Ting Ting...
"Tampil Stunning di ‘Silsila’, Drashti Dhami Puji Sang Desainer",iyaa.com | New Delhi: Penampilan Drashti Dhami di serial Silsila Badalte Rishton Ka memang beda...
Manisnya Siddharth Nigam Kenakan Pakaian Adat Jawa,iyaa.com | Jakarta: Aktor Chandra Nandini Siddharth Nigam saat ini tengah berada di Indonesia meramaikan...
"Daftar Pemenang ‘Anugerah Syiar Ramadhan 2018’, Ini Program TV Terbaik Versi KPI",iyaa.com | Jakarta: Komisi Penyiaran Indonesia (KPI) bersama Majelis Ulama Indonesia (MUI) dan  Kementerian Pemuda...
"‘Panji Manusia Millenium’ Tayang Lagi, MNCTV Ajak Nostalgia Penonton",iyaa.com | Jakarta: Sinetron lawas Panji Manusia Millenium kembali ditayangkan MNCTV. Episode perdananya tayang pada...
"Anjum Fakih, Pemeran Srishti di ‘Takdir Lonceng Cinta’",iyaa.com | Jakarta: Mulai pagi ini serial Takdir Lonceng Cinta tayang di ANTV. Serial ini...
"Ada Penampakan di Postingan Ayu Ting Ting, Netizen Ungkap Hal Ini",iyaa.com | Jakarta: Sebuah penampakan muncul dalam video postingan Ayu Ting Ting pada Selasa (26/6/2018)....
"Jerman Kalah di Tangan Korea, Roy Kiyoshi Banjir Bully-an Netizen",iyaa.com | Jakarta: Roy Kiyoshi sempat melalukan penerawangan soal negara yang akan membawa pulang trofi...
"Sinopsis ‘Nina Sahabat Sejati’ di RCTI, Kisah Hantu Cilik Mencari Orangtuanya","iyaa.com | Jakarta: Bertepatan dengan bulan Ramadan 2018, RCTI menyajikan sederet sinetron baru yang salah..."
"Sinopsis ‘Aku Bukan Ustadz’ RCTI, Saat yang Baik dan Buruk Tertukar","iyaa.com | Jakarta: Dibintangi Rifky Balweel, Eza Gionino dan Reuben Elishama, sinetron Aku Bukan Ustadz..."
"Pakai Hot Pants dan Kaos Ketat, Ashanty Banjir Protes Netizen",
"Buat Pemula, Waspada 5 Kesalahan Ini Saat Memakai Blush On!",iyaa.com | Jakarta: Setiap wanita selalu ingin terlihat cantik dan segar setiap hari. Blush On...
"Biasa Natural, Meghan Markle Tampil dengan Bold Makeup","iyaa.com | London: Meghan Markle biasanya tampil dengan makeup natural, bahkan di hari pernikahannya dengan..."
Brand Ini Bikin Kampanye Ajak Perempuan Tidak Malu dengan Bulu Tubuh,"iyaa.com | Jakarta: Tidak hanya jerawat, salah satu hal yang sering disembunyikan perempuan adalah bulu..."
Cantiknya Anita Hassanandani dan Surbhi Jyoti Tampil Kembaran di ‘Naagin 3’,iyaa.com | Jakarta: Serial Naagin Season 3 tengah dinantikan kehadirannya di India. Di musim ketiganya...
Masih Ingat Hijab Pocong yang Viral? Kini Ada Versi Pengantin Loh,"iyaa.com | Jakarta: Beberapa waktu lalu sempat heboh munculnya hijab pocong, yakni hijab yang memiliki..."
"Masih Dirahasiakan, Begini Prediksi Gaun Pengantin Meghan Markle (Bag. 2)",iyaa.com | Jakarta: Pangeran Harry dan Meghan Markle akan menikah pada 19 Mei 2018 mendatang...
"Muncul Lagi di ‘Cinta yang Hilang’, Ratna Galih – Alwi Assegaf Akhirnya Bertemu?","iyaa.com | Jakarta: Setelah sempat menghilang, Ratna Galih akhirnya muncul lagi di sinetron Cinta yang..."
"Sitkom ‘Office Boy – OB’ di-Remake, Sayuti Bakal Hadir Lagi di RCTI",iyaa.com | Jakarta: Masih ingat dengan serial situasi komedi atau sitkom Office Boy (OB)? Sitkom...
"Hamil Empat Bulan, Istri Karan Patel Alami Keguguran",iyaa.com | Mumbai: Beberapa waktu lalu Karan Patel akhirnya mengumumkan kabar bahagia atas kehamilan Ankita...
"Kalahkan Jerman 2-0 di Piala Dunia 2018, Kiper Korea Ini Dibilang Mirip Roy Kiyoshi","iyaa.com | Jakarta: Korea berhasil menghentikan langkah Jerman di Piala Dunia 2018 kemarin, Rabu (27/6/2018)...."
"Pakai Hot Pants dan Kaos Ketat, Ashanty Banjir Protes Netizen",
4 Mitos dan Fakta Seputar Aloe Vera Gel untuk Kecantikan,
"Serial India Baru ANTV, Ini rating ‘Mahakaali’ dan ‘Takdir Lonceng Cinta’",
"Lamarannya Ditolak, Mas Pur Pingsan di ‘Tukang Ojek Pengkolan’",
"Menderita Batu Ginjal, Aly Goni Masuk Rumah Sakit",
"Ikonik Banget, Rihanna Namai Shade Eyeliner-nya dari Jawaban Savage ke Haters!","iyaa.com | Jakarta: Beauty line milik Rihanna, Fenty Beauty, tak lama lagi akan segera merilis..."
"Pakai Hot Pants dan Kaos Ketat, Ashanty Banjir Protes Netizen",
"Masih Dirahasiakan, Begini Prediksi Gaun Pengantin Meghan Markle (Bag. 1)","iyaa.com | Jakarta: Pernikahan Pangeran Harry dan Meghan Markle tak lama lagi akan digelar, yakni..."
"Madonna Kenakan Mahkota Karya Desainer Indonesia di Met Gala 2018, So Stunning!",iyaa.com | Jakarta: Met Gala jadi ajang tahunan bergengsi bagi selebriti Hollywood. Mengusung tema “Heavenly...
"Pakai Hot Pants dan Kaos Ketat, Ashanty Banjir Protes Netizen",
"KPI Adakan ‘Anugerah Syiar Ramadhan 2018’, Ini Nominasinya","iyaa.com | Jakarta: Mengapresiasi program siaran terbaik selama bulan puasa, Komisi Penyiaran Indonesia (KPI) mengadakan..."
"Pakai Hot Pants dan Kaos Ketat, Ashanty Banjir Protes Netizen",
4 Mitos dan Fakta Seputar Aloe Vera Gel untuk Kecantikan,
4 Mitos dan Fakta Seputar Aloe Vera Gel untuk Kecantikan,
"Serial India Baru ANTV, Ini rating ‘Mahakaali’ dan ‘Takdir Lonceng Cinta’",
"Lamarannya Ditolak, Mas Pur Pingsan di ‘Tukang Ojek Pengkolan’",
‘Tercyduk’ SCTV Asli Atau Settingan? Begini Jawaban Lionil Hendrik,
Serial Tokusatsu ‘Legend Hero’ akan Tayang di RTV,
4 Mitos dan Fakta Seputar Aloe Vera Gel untuk Kecantikan,
"Serial India Baru ANTV, Ini rating ‘Mahakaali’ dan ‘Takdir Lonceng Cinta’",
"Lamarannya Ditolak, Mas Pur Pingsan di ‘Tukang Ojek Pengkolan’",
"Menderita Batu Ginjal, Aly Goni Masuk Rumah Sakit",
4 Mitos dan Fakta Seputar Aloe Vera Gel untuk Kecantikan,
"Serial India Baru ANTV, Ini rating ‘Mahakaali’ dan ‘Takdir Lonceng Cinta’",
"Lamarannya Ditolak, Mas Pur Pingsan di ‘Tukang Ojek Pengkolan’",
"Serial India Baru ANTV, Ini rating ‘Mahakaali’ dan ‘Takdir Lonceng Cinta’",
"Lamarannya Ditolak, Mas Pur Pingsan di ‘Tukang Ojek Pengkolan’",
"Menderita Batu Ginjal, Aly Goni Masuk Rumah Sakit",
‘Tercyduk’ SCTV Asli Atau Settingan? Begini Jawaban Lionil Hendrik,
Serial Tokusatsu ‘Legend Hero’ akan Tayang di RTV,
"Yuk, Kenalan Sama Pemain & Karakter ‘APACE, Anak Punk Anti Cewek’ RCTI",
"Pindah Jam Tayang, ‘Hafizah’ Masuki Episode Terakhir di RCTI",
Ini Daftar Lagu Kontestan ‘Indonesian Idol 2018’ di Babak Top 9,
‘Tercyduk’ SCTV Asli Atau Settingan? Begini Jawaban Lionil Hendrik,
Serial Tokusatsu ‘Legend Hero’ akan Tayang di RTV,
"Yuk, Kenalan Sama Pemain & Karakter ‘APACE, Anak Punk Anti Cewek’ RCTI",
"Menderita Batu Ginjal, Aly Goni Masuk Rumah Sakit",
‘Tercyduk’ SCTV Asli Atau Settingan? Begini Jawaban Lionil Hendrik,
"Menderita Batu Ginjal, Aly Goni Masuk Rumah Sakit",
‘Tercyduk’ SCTV Asli Atau Settingan? Begini Jawaban Lionil Hendrik,
Serial Tokusatsu ‘Legend Hero’ akan Tayang di RTV,
"Yuk, Kenalan Sama Pemain & Karakter ‘APACE, Anak Punk Anti Cewek’ RCTI",
"Pindah Jam Tayang, ‘Hafizah’ Masuki Episode Terakhir di RCTI",
Serem! Ada Penampakan di Lokasi Syuting ‘Kenapa Aku Jadi Lutung’ MNCTV,
Julukan Baru Beby Tsabina di ‘Catatan Harian Aisha’,
"ANTV Ultah, ‘Karma’ Sukses Jadi Rating Nomor 1",
"Sinopsis ‘Dia yang Tak Terlihat’, Kisah Cinta Berbalut Misteri Pembunuhan",
"Pindah Jam Tayang, ‘Hafizah’ Masuki Episode Terakhir di RCTI",
"Siap-Siap, Rollover Reaction Sebentar Lagi Punya Offline Store Loh!",
Serial Tokusatsu ‘Legend Hero’ akan Tayang di RTV,
"Yuk, Kenalan Sama Pemain & Karakter ‘APACE, Anak Punk Anti Cewek’ RCTI",
"Pindah Jam Tayang, ‘Hafizah’ Masuki Episode Terakhir di RCTI",
"Buat Video Tutorial Makeup untuk Sahur, MAC Cosmetics Tuai Pro Kontra",
"Yuk, Kenalan Sama Pemain & Karakter ‘APACE, Anak Punk Anti Cewek’ RCTI",
"Pindah Jam Tayang, ‘Hafizah’ Masuki Episode Terakhir di RCTI",
"Tayang di Slot ‘Nada Cinta Pelangi’, MNCTV Hadirkan ‘Jaka Bersisik Emas’",
Alasan Utama Ranty Maria Hengkang dari ‘Anak Langit’ SCTV,
"Selamat, Gaurav Chopra ‘Uttaran’ Menikah!",
"Sinopsis ‘Dia yang Tak Terlihat’, Kisah Cinta Berbalut Misteri Pembunuhan",
"Mirip ‘Putri yang Ditukar’, Begini Sinopsis ‘Ada Dua Cinta’ RCTI",
"‘Pesbukers’ Balik ke Slot Sore, ‘Dil Se Dil Tak’ Dibungkus ANTV?",
"Mawar Eva Bintangi Sinetron Horor RCTI, Gantikan ‘Hafizah’?",
Wardah Hadirkan Eyebrow Kit Untuk Bentuk Alis Sempurnamu,
"Sinopsis ‘Dia yang Tak Terlihat’, Kisah Cinta Berbalut Misteri Pembunuhan",
"Mirip ‘Putri yang Ditukar’, Begini Sinopsis ‘Ada Dua Cinta’ RCTI",
Fay Nabila Akui Mirip dengan Karakter Riska di ‘Orang Ketiga’,
"LIDA Top 15: Arif Beri Kejutan, Renaldi Gagal ke 10 Besar",
Serial ‘Shani’ di India Mau Tamat? Ini Kata Juhi Parmar ‘Sangya’,
"LIDA Top 8: Gagal Lolos ke 5 Besar, Ini yang Dirasakan Khori",
"Sinopsis ‘Dia yang Tak Terlihat’, Kisah Cinta Berbalut Misteri Pembunuhan",
"Mirip ‘Putri yang Ditukar’, Begini Sinopsis ‘Ada Dua Cinta’ RCTI",
"‘Pesbukers’ Balik ke Slot Sore, ‘Dil Se Dil Tak’ Dibungkus ANTV?",
"‘Pesbukers’ Balik ke Slot Sore, ‘Dil Se Dil Tak’ Dibungkus ANTV?",
"Sinopsis ‘Dia yang Tak Terlihat’, Kisah Cinta Berbalut Misteri Pembunuhan",
"Mirip ‘Putri yang Ditukar’, Begini Sinopsis ‘Ada Dua Cinta’ RCTI",
"‘Pesbukers’ Balik ke Slot Sore, ‘Dil Se Dil Tak’ Dibungkus ANTV?",
"Mirip ‘Putri yang Ditukar’, Begini Sinopsis ‘Ada Dua Cinta’ RCTI",
"‘Pesbukers’ Balik ke Slot Sore, ‘Dil Se Dil Tak’ Dibungkus ANTV?",
5 Gaun Terbaik di Met Gala 2018,"iyaa.com | Jakarta: Ajang tahunan Met Gala kembali. Pada tahun ini, Met Gala 2018 mengusung..."
"Duet Bareng Boy William di ‘ICA 5.0’, Penampilan Via Vallen Kece Banget!","iyaa.com | Jakarta: Via Vallen sukses mengguncang panggung Indonesian Choice Awards 5.0 di NET semalam,..."
5 Museum Fashion di Eropa yang Recommended Banget Dikunjungi,"iyaa.com | Jakarta: Bagi kamu penyuka fashion, kamu wajib mengunjungi museum fashion yang populer di..."
"Pindah ke ‘APACE’, Anjani Dina – Bu Guru Yola ‘Dunia Terbalik’ Bikin Pangling",iyaa.com | Jakarta: Anjani Dina dikenal sebagai pemeran Bu Guru Yola dalam sinetron Dunia Terbalik...
"Sinopsis ‘Cinta yang Hilang’, Kisah Alwi Assegaf & Audrey Junicka Cari Ayah Kandung","iyaa.com | Jakarta: Sukses dengan Cahaya Hati, RCTI kembali pasangkan Alwi Assegaf dan Audrey Junicka..."
"Biar Jeans Gak Cepat Belel, Perhatikan Ini Saat Mencucinya","iyaa.com | Jakarta: Pakaian berbahan jeans memang menjadi favorit dan sering dipakai untuk banyak keperluan,..."
"Sinopsis ‘Amanah Wali 2’, Begini Kisah Faank Cs Usai Keluar dari Pesantren",iyaa.com | Jakarta: Sinetron religi Amanah Wali kembali hadir Ramadan ini di RCTI. Di season...
"Sinopsis ‘Tendangan Garuda’, Kisah Anak Kampung Ingin Jadi Jawara Sepak Bola","iyaa.com | Jakarta: MNCTV menghadirkan sinetron anak terbaru mulai hari ini, Senin (23/4/2018). Berjudul Tendangan..."
"Sinopsis ‘Utusan dari Surga’, Saat Baim Wong Berdakwah di Kampung Penjahat","iyaa.com | Jakarta: Sinetron Utusan dari Surga dibintangi Baim Wong tayang perdana malam ini, Rabu..."
"Bak Barbie Hidup, Nia Ramadhani Cantik dan Seksi di Ultah Suami","iyaa.com | Jakarta: Pulang dari Festival Coachella 2018, Nia Ramadhani semakin cantik memukau. Gaya fashion..."
Cantiknya Eisha Singh Berhijab di ‘Ishq Subhan Allah’,"iyaa.com | Mumbai: Aktris Ishq Ka Rang Safed (IKRS), Eisha Singh, saat ini membintangi serial..."
"Gokil, Desainer Ini Ciptakan Hijab Pocong untuk Lebaran 2018",iyaa.com | Jakarta: Ada-ada saja tren hijab yang diciptakan desainer yang satu ini. Bukannya tren...
"Sinopsis ‘APACE’, Saat Tiga Anak Punk Anti Cewek Jatuh Cinta di RCTI","iyaa.com | Jakarta: Dibintangi Mando GW, Fachri Muhammad dan Bhisma Wijaya, sinetron komedi APACE, Anak..."
"Sinopsis ‘Ishq Ka Rang Safed’, Kisah Cinta Pria Kaya dan Janda Muda","iyaa.com | Jakarta: Serial Ishq Ka Rang Safed tayang perdana hari inim Senin (9/4/2018), di..."
"Antiperspirant Meninggalkan Noda di Baju, Ternyata Ini Alasannya!",iyaa.com | Jakarta: Orang sering memakai antiperspirant untuk mencegah bau badan saat beraktivitas seharian. Sayangnya...
"Gaya ala Roy Kiyoshi, Rina Nose Malah Dibilang Mirip Song Joong Ki",iyaa.com | Jakarta: Rina Nose kembali membuat netizen tertawa lewat penampilannya di program Opera Van...
"Perdana Tampil Berhijab di TV, Intip Gaya Rock Tantri Kotak di ‘Idol’ 2018",iyaa.com | Jakarta: Tantri Syailindri tampil dengan hijabnya bersama band Kotak di babak Top 3...
"Sinopsis ‘Cinta Kedua’, Mampukah Dude Harlino Pertahankan Rumah Tangganya?","iyaa.com | Jakarta: Dibintangi Dude Harlino, Alyssa Soebandono dan Cut Meyriska, sinetron Cinta Kedua tayang..."
"Sinopsis ‘Dia yang Tak Terlihat’, Kisah Cinta Berbalut Misteri Pembunuhan","iyaa.com | Jakarta: Dibintangi Rifky Balweel, Mawar Eva De Jongh dan Yunita Siregar, sinetron Dia..."
Masker Kentang dan Lidah Buaya untuk Menumbuhkan Rambut Secara Alami,iyaa.com | Jakarta: Bahan-bahan alami bisa dimanfaatkan untuk merangsang pertumbuhan rambut. Apalagi buat yang mengalami...
"Gak Perlu Blush On, Ini Cara Alami Dapatkan Pipi Merah Merona",iyaa.com | Jakarta: Pipi merah merona membuat wajah terlihat selalu segar dan mempesona. Blush on...
"Kejutan di Bulan Juli, Beauty Blender Akan Rilis Sponge Case untuk Travelling!",iyaa.com | Jakarta: Beauty Blender sukses membuat industri kecantikan berbondong-bondong membuat sponge makeup berbentuk tetesan...
"Pakai Hot Pants dan Kaos Ketat, Ashanty Banjir Protes Netizen",
4 Mitos dan Fakta Seputar Aloe Vera Gel untuk Kecantikan,
"Serial India Baru ANTV, Ini rating ‘Mahakaali’ dan ‘Takdir Lonceng Cinta’",
Sinopsis ‘Nada Cinta Pelangi’ Dibintangi Yasamin Jasem – Randy Martin,"iyaa.com | Jakarta: Menggantikan Rindu Bilang Sayang, Nada Cinta Pelangi tayang perdana hari ini, Senin..."
‘Pardes’ Episode Terakhir: Meninggalnya Reehan dan Akhir Kisah Naina,"iyaa.com | Jakarta: Serial India Pardes akan tamat sore ini, Kamis (22/3/2018). Episode terakhir Pardes..."
"Pakai Hot Pants dan Kaos Ketat, Ashanty Banjir Protes Netizen",
"Bikin Tak Sabar, Fenty Beauty Rihanna Segera Rilis Koleksi Eye Makeup Terbaru",iyaa.com | Jakarta: Fenty Beauty milik Rihanna kembali hadir dengan koleksi terbarunya. Kali ini yang...
"Produk Kecantikan Mahal Sudah Pasti Bagus, Benarkah Demikian?","iyaa.com | Jakarta: Produk kecantikan hadir dengan harga yang bervariasi, mulai dari yang murah sampai..."
"Awas, 4 Kebiasaan Ini Bikin Bekas Jerawatmu Betah Tinggal di Wajah!","iyaa.com | Jakarta: Bekas jerawat sangat menyebalkan. Ada yang beruntung karena bisa mengatasinya, dan ada..."
"Lamarannya Ditolak, Mas Pur Pingsan di ‘Tukang Ojek Pengkolan’",
"Menderita Batu Ginjal, Aly Goni Masuk Rumah Sakit",
‘Tercyduk’ SCTV Asli Atau Settingan? Begini Jawaban Lionil Hendrik,
4 Mitos dan Fakta Seputar Aloe Vera Gel untuk Kecantikan,
"Serial India Baru ANTV, Ini rating ‘Mahakaali’ dan ‘Takdir Lonceng Cinta’",
"Lamarannya Ditolak, Mas Pur Pingsan di ‘Tukang Ojek Pengkolan’",
Ini Alasan Kenapa Sarung Bantal Harus Sering Dicuci,iyaa.com | Jakarta: Ada banyak sebab kenapa wajahmu berjerawat. Salah satunya mungkin saja adalah sarung...
"Ini Alasan Produk Kecantikan Diuji Coba ke Hewan, Ternyata…","iyaa.com | Jakarta: Kalau kamu perhatikan kemasan sebuah produk kecantikan, di beberapa produk kamu akan..."
Wajah Cerah Tanpa Makeup dengan POND’S InstaBright Tone Up Cream,iyaa.com | Jakarta: Wajah cerah alami dan merona jadi impian banyak wanita. Beragam cara dilakukan...
Mouni Roy Merinding Lihat Poster Film Debutnya,"iyaa.com | Mumbai: Trailer film Mouni Roy, Gold, akhirnya dirilis. Dalam trailer tersebut, kita bisa..."
"Sudah 10 Tahun Pacaran, Kunal Bakshi akan Segera Menikah","iyaa.com | New Delhi: Setelah Abhinav Shukla dan Rubina Dilaik, kabar bahagia juga datang dari..."
‘The Legend of Jade Sword’ Segera Tayang di NET TV,"iyaa.com | Jakarta: Tampil beda dengan stasiun TV lainnya, NET TV siap tayangkan serial Mandarin..."
"Lama Tak Tayang, ‘Nina Sahabat Sejati’ Umumkan Episode Terakhir",iyaa.com | Jakarta: Nina Sahabat Sejati sudah beberapa hari terakhir tidak tayang di RCTI. Sayangnya...
Serial Tokusatsu ‘Legend Hero’ akan Tayang di RTV,
"Yuk, Kenalan Sama Pemain & Karakter ‘APACE, Anak Punk Anti Cewek’ RCTI",
"Pindah Jam Tayang, ‘Hafizah’ Masuki Episode Terakhir di RCTI",
"Menderita Batu Ginjal, Aly Goni Masuk Rumah Sakit",
‘Tercyduk’ SCTV Asli Atau Settingan? Begini Jawaban Lionil Hendrik,
Serial Tokusatsu ‘Legend Hero’ akan Tayang di RTV,
"Pakai Hot Pants dan Kaos Ketat, Ashanty Banjir Protes Netizen",
4 Mitos dan Fakta Seputar Aloe Vera Gel untuk Kecantikan,
"Serial India Baru ANTV, Ini rating ‘Mahakaali’ dan ‘Takdir Lonceng Cinta’",
"Shakti Arora Rayakan 4 Tahun ‘Ranveer dan Ishani’, Bikin Kangen!",iyaa.com | Jakarta: Shakti Arora mengenang 4 tahun penayangan serial Ranveer dan Ishani (Meri Aashiqui...
"Dinda Hauw Super Nyebelin di ‘STJC’, Aktris Ini Jadi Haters Dadakan",iyaa.com | Jakarta: Dinda Hauw kembali banjir komentar pedas netizen. Ribuan komentar datang di instagram...
"Jadi Antagonis, Abhinav Shukla Pernah Tolak Tawaran Main ‘Silsila’",iyaa.com | Mumbai: Abhinav Shukla kembali beradu akting dengan Drashti Dhami di Silsila Badalte Rishton...
"Rezca Syam Minta Maaf, ‘Utusan Dari Surga’ Tamat di RCTI?",iyaa.com | Jakarta: Sinetron Utusan dari Surga tak lagi tayang di RCTI. Jam tayang Utusan...
"Gaet Aktor Mirip Aliando, Ini Deretan Pemain ‘Drakula Cantik’ SCTV","iyaa.com | Jakarta: Mengulang kesuksesan Ganteng Ganteng Serigala, SCTV bekerja sama dengan Amanah Surga Productions..."
4 Tips Memilih Sunscreen Agar Kulit Terlindungi Maksimal Selama Berpuasa,
"ANTV Ultah, ‘Karma’ Sukses Jadi Rating Nomor 1",
"Perannya Berakhir di ‘Chandra Nandini’, Saanvi Talwar: Ini Pengalaman Luar Biasa",
"Yuk, Kenalan Sama Pemain & Karakter ‘APACE, Anak Punk Anti Cewek’ RCTI",
"Pindah Jam Tayang, ‘Hafizah’ Masuki Episode Terakhir di RCTI",
"Takut Dicontoh Anak-Anak, Netizen Minta Sasha Dihilangkan di ‘Anak Langit’",
"Lamarannya Ditolak, Mas Pur Pingsan di ‘Tukang Ojek Pengkolan’",
"Menderita Batu Ginjal, Aly Goni Masuk Rumah Sakit",
Manish Goplani Bintangi Serial Baru ‘Yeh Teri Galiyan’,"iyaa.com | New Delhi: Setelah berakhirnya serial Detective Didi pada Maret lalu, Manish Goplani langsung..."
"Debut Bollywood, Mohit Raina Jadi Tentara di Film ‘Uri’",iyaa.com | New Delhi: Mohit Raina yang terkenal lewat serial Mahadewa akhirnya akan menjajal kemampuan...
"Sempat Dicibir, Akting Megan Domani Jadi Gadis Kampung Banjir Pujian","iyaa.com | Jakarta: Setelah Sodrun Merayu Tuhan tamat, Megan Domani kini bintangi sinetron Seleb di..."
"Bukan Karena Rating, Ini Alasan SCTV Tamatkan ‘Cinta Kedua’","iyaa.com | Jakarta: Dibintangi Dude Harlino, Alyssa Soebandono dan Cut Meyriska, sinetron Cinta Kedua tamat..."
"Siap Tayang, ‘The Voice Kids Indonesia Season 3’ Hadirkan Coach Baru",iyaa.com | Jakarta: Ajang pencarian bakat The Voice Kids Indonesia tahun ini kembali diadakan. Memasuki...
"‘Drakula Drakula Cantik’ Siap Tayang, SCTV Ungkap Kegagalan ‘GGS’","iyaa.com | Jakarta: Setelah sukses dengan Ganteng Ganteng Serigala (GGS), SCTV siapkan sinetron terbarunya berjudul..."
"Sinopsis ‘Dia yang Tak Terlihat’, Kisah Cinta Berbalut Misteri Pembunuhan",
"Mirip ‘Putri yang Ditukar’, Begini Sinopsis ‘Ada Dua Cinta’ RCTI",
"‘Pesbukers’ Balik ke Slot Sore, ‘Dil Se Dil Tak’ Dibungkus ANTV?",
"Jadwal ‘Nada Cinta Pelangi’ Dirilis, ‘Rindu Bilang Sayang’ Tamat?",
‘Masihkah Kau Mencintaiku’ Dipandu Anjasmara Tayang Lagi di RCTI,
‘Tercyduk’ SCTV Asli Atau Settingan? Begini Jawaban Lionil Hendrik,
Serial Tokusatsu ‘Legend Hero’ akan Tayang di RTV,
"Yuk, Kenalan Sama Pemain & Karakter ‘APACE, Anak Punk Anti Cewek’ RCTI",
Abhinav Shukla Resmi Menikah dengan Rubina Dilaik,"iyaa.com | New Delhi: Pemain serial Geet, Abhinav Shukla, akhirnya menikah dengan sang kekasih yang..."
"Posting Foto Liburan di Italia, Hidung Roy Kiyoshi Jadi Sorotan",iyaa.com | Jakarta: Roy Kiyoshi kembali jadi sorotan netizen. Setelah bentuk dagunya yang bikin salah...
"Pakai Hot Pants dan Kaos Ketat, Ashanty Banjir Protes Netizen",
"Sukses dengan ‘Ganteng-Ganteng Serigala’, SCTV Siapkan ‘Drakula Drakula Cantik’",iyaa.com | Jakara: Sinetron Ganteng Ganteng Serigala (GGS) sukses melambungkan sederet aktor muda berbakat seperti...
"Tayang Perdana di Jam Kramat, ‘Seleb’ SCTV Raih Rating Tinggi","iyaa.com | Jakarta: Sempat tuai protes dan cibiran, episode perdana Seleb sukses curi perhatian penonton..."
"Sinopsis ‘Dia yang Tak Terlihat’, Kisah Cinta Berbalut Misteri Pembunuhan",
"Mirip ‘Putri yang Ditukar’, Begini Sinopsis ‘Ada Dua Cinta’ RCTI",
"Pindah Jam Tayang, ‘Hafizah’ Masuki Episode Terakhir di RCTI",
Dehidrasi dan Bibir Hitam Selama Puasa? Simak Cara Mengatasinya!,
