judul,deskripsi"Lamarannya Ditolak, Mas Pur Pingsan di ‘Tukang Ojek Pengkolan’",
"Menderita Batu Ginjal, Aly Goni Masuk Rumah Sakit",
Serial Tokusatsu ‘Legend Hero’ akan Tayang di RTV,
"Yuk, Kenalan Sama Pemain & Karakter ‘APACE, Anak Punk Anti Cewek’ RCTI",
"Pindah Jam Tayang, ‘Hafizah’ Masuki Episode Terakhir di RCTI",
"Heboh Kasus Cinta Segitiga, Kriss Hatta Banjir Dukungan Fans",
‘Kedai Pak Mantep’ Diperingatkan KPI Gara-Gara Duo Serigala,
‘Tercyduk’ SCTV Asli Atau Settingan? Begini Jawaban Lionil Hendrik,
Serial Tokusatsu ‘Legend Hero’ akan Tayang di RTV,
"Yuk, Kenalan Sama Pemain & Karakter ‘APACE, Anak Punk Anti Cewek’ RCTI",
"Pindah Jam Tayang, ‘Hafizah’ Masuki Episode Terakhir di RCTI",
"Heboh Harga Tiket Konser Lucinta Luna, Begini Reaksi Netizen",
"Sinopsis ‘Dia yang Tak Terlihat’, Kisah Cinta Berbalut Misteri Pembunuhan",
"Berubah Total, Shashank Vyas ‘Anandhi’ Nyaris Tak Dikenali",
"Biasa Tampil Glamor, Syahrini Ungkap Rahasia Penampilan Cetarnya",
Ucapan Terima Kasih Pemain Usai Tamatnya ‘Cinta Kedua’ di SCTV,
"Mirip ‘Putri yang Ditukar’, Begini Sinopsis ‘Ada Dua Cinta’ RCTI",
"‘Pesbukers’ Balik ke Slot Sore, ‘Dil Se Dil Tak’ Dibungkus ANTV?",
"Sinopsis ‘Dia yang Tak Terlihat’, Kisah Cinta Berbalut Misteri Pembunuhan",
"Mirip ‘Putri yang Ditukar’, Begini Sinopsis ‘Ada Dua Cinta’ RCTI",
"‘Pesbukers’ Balik ke Slot Sore, ‘Dil Se Dil Tak’ Dibungkus ANTV?",
"Jelang Konser di Jakarta, The Script Tampil di ‘Indonesian Idol’",iyaa.com | Jakarta: Musisi internasional kembali dihadirkan RCTI di panggung Indonesian Idol 2018. Kali ini...
"‘Pesbukers’ Balik ke Slot Sore, ‘Dil Se Dil Tak’ Dibungkus ANTV?",iyaa.com | Jakarta: Kabar terbaru datang dari program Pesbukers ANTV. Program yang dipandu Raffi Ahmad...
"Jadi Kaya Raya, Penampilan Baru Natasha Wilona Bikin Penasaran",iyaa.com | Jakarta: Penampilan Natasha Wilona berubah 180 derajat. Setelah jati dirinya terungkap dan mengetahui...
"Masih Penasaran, ‘Karma’ ANTV Diminta Undang Lucinta Luna",iyaa.com | Jakarta: Belakangan nama Lucinta Luna populer di media sosial. Personil grup musik Duo...
"Okie Agustina Kerasukan, Roy Kiyoshi Ungkap Hal Mistis di Studio ‘Karma’ ANTV",iyaa.com | Jakarta: Okie Agustina alami kejadian kurang menyenangkan dalam program Karma ANTV. Mantan istri...
"LIDA Top 15: Kurang Beri Kejutan, Nando Gagal ke Babak Selanjutnya","iyaa.com | Jakarta: Duta Jawa Barat, Nando, tersisih di babak 15 besar Liga Dangdut Indonesia..."
"ANTV Buka Pendaftaran Partisipan ‘Karma’ Show, Minat?",iyaa.com | Jakarta: Karma show ANTV makin diminati penonton. Program yang dipandu Robby Purba dan...
"Finalis Top 3 ‘Idol’ Iseng Nyanyi Dangdut, Netizen Usulkan Lagu Ini",iyaa.com | Jakarta: Tak hanya Judika yang suka dangdutan kala menjadi juri Indonesian Idol 2018....
"Tayang di Slot ‘Nada Cinta Pelangi’, MNCTV Hadirkan ‘Jaka Bersisik Emas’",iyaa.com | Jakarta: MNCTV menghadirkan lagi sinetron barunya. Kali ini sebuah mini seri tentang manusia...
"Pemain Tulis Caption Ini, ‘Nada Cinta Pelangi’ Mau Tamat?",iyaa.com | Jakarta: Penggemar sinetron Nada Cinta Pelangi mendadak khawatir sinetronnya segera tamat. Padahal sinetron...
"Pakai Hot Pants dan Kaos Ketat, Ashanty Banjir Protes Netizen",
4 Mitos dan Fakta Seputar Aloe Vera Gel untuk Kecantikan,
"Serial India Baru ANTV, Ini rating ‘Mahakaali’ dan ‘Takdir Lonceng Cinta’",
"Lamarannya Ditolak, Mas Pur Pingsan di ‘Tukang Ojek Pengkolan’",
"Menderita Batu Ginjal, Aly Goni Masuk Rumah Sakit",
‘Tercyduk’ SCTV Asli Atau Settingan? Begini Jawaban Lionil Hendrik,
Serial Tokusatsu ‘Legend Hero’ akan Tayang di RTV,
"Yuk, Kenalan Sama Pemain & Karakter ‘APACE, Anak Punk Anti Cewek’ RCTI",
"Pindah Jam Tayang, ‘Hafizah’ Masuki Episode Terakhir di RCTI",
"Bukan Sinetron, Ini Jadwal Tayang ‘Trio BBB, Menguak Takdir’ di SCTV",
"Adly Fayruz Nikah Juga, ‘Jodoh Wasiat Bapak’ Mau Tamat?",
Karishma Tanna dan Rajat Tokas Dansa Romantis di Teaser ‘Naagin 3’,
"Sinopsis ‘Dia yang Tak Terlihat’, Kisah Cinta Berbalut Misteri Pembunuhan",
"Mirip ‘Putri yang Ditukar’, Begini Sinopsis ‘Ada Dua Cinta’ RCTI",
"‘Pesbukers’ Balik ke Slot Sore, ‘Dil Se Dil Tak’ Dibungkus ANTV?",
"9 Faktor Ini Ternyata Jadi Penyebab Kulitmu Terus Berminyak, Nomor 8 Bikin Kaget!","iyaa.com | Jakarta: Kulit punya beberapa tipe, salah satunya adalah kulit berminyak. Kulit berminyak disebabkan..."
"Disandingkan dengan Bunga Citra Lestari, Bibir Lucinta Luna Jadi Sorotan",iyaa.com | Jakarta: Penampilan Bunga Citra Lestari sempat disebut mirip dengan Lucinta Luna saat hadir...
Abdul Terharu Sang Ayah Nonton Langsung ‘Indonesian Idol 2018’,iyaa.com | Jakarta: Ada satu keinginan Ahmad Abdul yang terwujud di Indonesian Idol. Sang ayah...
"Tak Perlu Berlebihan, Ini Tips Makeup untuk Remaja Perempuan","iyaa.com | Jakarta: Sebagai remaja, tak ada salahnya mencoba memakai makeup untuk penampilan yang berbeda..."
"Roy Kiyoshi Komentari Negatif Film ‘The Secret’, Raffi Ahmad: Udah Clear",iyaa.com | Jakarta: Roy Kiyoshi sempat berikan komentar untuk film The Secret yang tengah dipromosikan...
Sssttt… Perhatikan Hal ini Sebelum Memakai Aloe Vera Gel!,"iyaa.com | Jakarta: Produk yang mengandung aloe vera banyak diminati wanita Indonesia, khususnya aloe vera..."
"Perannya di ‘TOP’ Diprotes, Tissa Biani Malah Merasa Tertantang","iyaa.com | Jakarta: Usai tamatnya sinetron Catatan Harian Aisha, Tissa Biani kini bermain dalam sitkom..."
Ankit Bathla Jadi Pemain Baru di ‘Tu Sooraj Main Saanjh Piyaji’,iyaa.com | Mumbai: Ankit Bathla yang dikenal lewat serial Thapki akan segera kembali ke layar...
"Sebelum Dirilis Resmi, Yuk Intip Tampilan Koleksi Makeup Kolaborasi JLOxInglot",iyaa.com | Jakarta: Jennifer Lopez (J.Lo) termasuk selebriti yang akan merintis bisnis makeup line. J.Lo...
"Elvy Sukaesih Hadir Lagi di ‘LIDA’, Soimah Dkk Menangis Haru","iyaa.com | Jakarta: Semenjak kasus narkoba menjerat anak-anaknya, Elvy Sukaesih sempat menghilang dari Liga Dangdut..."
"Siap-Siap, Rollover Reaction Sebentar Lagi Punya Offline Store Loh!",iyaa.com | Jakarta: Rollover Reaction merupakan salah satu brand lokal yang menjual produk makeupnya secara...
"Sudah Tamat, Tissa Biani Kasih Kode ‘Catatan Harian Aisha’ Lanjut Season 2?",iyaa.com | Jakarta: Tissa Biani sedih saat sinetron Catatan Harian Aisha harus tamat di RCTI....
"Berdasarkan Zodiak, Ini Warna Lipstik yang Cocok Kamu Kenakan!",iyaa.com | Jakarta: Banyaknya lipstik yang beredar di pasaran membuat perempuan dibuat bingung warna apa...
Cara Mudah Membuat Scrub Alami dari Gula,"iyaa.com | Jakarta: Eksfoliasi bisa dilakukan dengan bahan alami di rumah, seperti gula pasir. Gula..."
"Marshanda – Naysilla Mirdad Foto Bareng, Topi ‘Mas Aris’ Curi Perhatian",iyaa.com | Jakarta: Marshanda dan Naysilla Mirdad saat ini terlibat di satu sinetron yakni Orang...
"Kendall Jenner Jarang Pakai Bra, Suntik Puting Kini Jadi Tren Kecantikan","iyaa.com | Jakarta: Jarang terlihat memakai bra dalam tiap penampilannya, Kendall Jenner kini jadi pencetus..."
"Beauty Queen, Makeup Series Terbaru dari Mustika Ratu yang Mengandung Ekstrak Daun Kelor",iyaa.com | Jakarta: Industri kecantikan terus berlomba menelurkan inovasi baru. Salah satunya datang dari brand...
"Fakta Kartikey Malviya ‘Shani’, Ini Olahraga dan Makanan Favoritnya","iyaa.com | Jakarta: Seiring dengan populernya serial Shani, Kartikey Malviya kini mulai disukai oleh pemirsa..."
"Hadir di ‘Karma’ ANTV, Ini Kata Riew WP Pria Indigo dari Thailand",iyaa.com | Jakarta: Program Karma show hadirkan episode spesial dalam rangka HUT ANTV. Dua episode...
"Jadi Antagonis Lagi, Cut Meyriska: Hello Kitty is Back!","iyaa.com | Jakarta: Bintangi sinetron Cinta Kedua, Cut Ratu Meyriska kembali perankan karakter antagonis. Dalam..."
"Pakai Hot Pants dan Kaos Ketat, Ashanty Banjir Protes Netizen",
"Pakai Hot Pants dan Kaos Ketat, Ashanty Banjir Protes Netizen",
4 Mitos dan Fakta Seputar Aloe Vera Gel untuk Kecantikan,
"Serial India Baru ANTV, Ini rating ‘Mahakaali’ dan ‘Takdir Lonceng Cinta’",
"Lamarannya Ditolak, Mas Pur Pingsan di ‘Tukang Ojek Pengkolan’",
"Menderita Batu Ginjal, Aly Goni Masuk Rumah Sakit",
4 Mitos dan Fakta Seputar Aloe Vera Gel untuk Kecantikan,
"Serial India Baru ANTV, Ini rating ‘Mahakaali’ dan ‘Takdir Lonceng Cinta’",
"Lamarannya Ditolak, Mas Pur Pingsan di ‘Tukang Ojek Pengkolan’",
"Menderita Batu Ginjal, Aly Goni Masuk Rumah Sakit",
‘Tercyduk’ SCTV Asli Atau Settingan? Begini Jawaban Lionil Hendrik,
Serial Tokusatsu ‘Legend Hero’ akan Tayang di RTV,
"Yuk, Kenalan Sama Pemain & Karakter ‘APACE, Anak Punk Anti Cewek’ RCTI",
"Pindah Jam Tayang, ‘Hafizah’ Masuki Episode Terakhir di RCTI",
Curhatan Maia Estianty Saat Kevin Tereliminasi di ‘Indonesian Idol 2018’,
"Ada ‘Di Luar Nalar’, ‘Si Doel Anak Sekolahan’ Pindah Jam Tayang di RCTI","iyaa.com | Jakarta: RCTI hadirkan program baru di slot siangnya, Di luar Nalar. program yang..."
"Stefan William Batal Nikah, ‘Anak Langit’ Diminta Ganti Judul ‘Gagal Nikah’",iyaa.com | Jakarta: Kisah cinta Stefan William kembali diuji. Pernikahannya dengan Nasya Marcella digagalkan Mischa...
"Suaranya Mirip Mulan Jameela, Netizen Heran Biang Es ‘The Mask Singer 2’ Diganti",iyaa.com | Jakarta: Babak Semi Final The Mask Singer Indonesia Season 2 masih bergulir. Netizen...
‘Tercyduk’ SCTV Asli Atau Settingan? Begini Jawaban Lionil Hendrik,
Serial Tokusatsu ‘Legend Hero’ akan Tayang di RTV,
"Yuk, Kenalan Sama Pemain & Karakter ‘APACE, Anak Punk Anti Cewek’ RCTI",
"Pindah Jam Tayang, ‘Hafizah’ Masuki Episode Terakhir di RCTI",
Judika Bangga Jadi Bagian Karier Kevin ‘Indonesian Idol 2018’,
"Mirip ‘Uang Kaget’ GTV, ‘Rejeki Dari Langit’ ANTV Dinilai Menyusahkan Target",
"Siddharth Nigam Balik ke India, Ini yang Berkesan Selama di Indonesia",
"Sinopsis ‘Dia yang Tak Terlihat’, Kisah Cinta Berbalut Misteri Pembunuhan",
"Mirip ‘Putri yang Ditukar’, Begini Sinopsis ‘Ada Dua Cinta’ RCTI",
"LIDA Top 15: Ditantang Duet, Randa-Nabila-Nando Tampil Memukau",iyaa.com | Jakarta: Persaingan Grup 3 di babak 15 besar Liga Dangdut Indonesia (LIDA) dimulai...
"‘Ishq Ka Rang Safed’ Tayang Sore Hari di MNCTV, Catat Jadwalnya",iyaa.com | Jakarta: Serial Ishq Ka Rang Safed yang dinantikan kehadirannya akhirnya tayang di MNCTV....
"Lama Jomblo, Mas Pur Bakal Nikah di ‘Tukang Ojek Pengkolan’?",iyaa.com | Jakarta: Purno alias Purnomo merupakan salah satu karakter utama di sitkom Tukang Ojek...
"Tayang di Jam Kramat, Rating Perdana ‘Cinta Kedua’ Tembus 10 Besar","iyaa.com | Jakarta: Dibintangi Dude Harlino dan Alyssa Soebandono, sinetron Cinta Kedua tayang perdana pada..."
"‘Pesbukers’ Balik ke Slot Sore, ‘Dil Se Dil Tak’ Dibungkus ANTV?",
"Afifah Mantap Bercerai, Fans ‘Orang Ketiga’ Kirim Karangan Bunga Spesial",iyaa.com | Jakarta: Hubungan Afifah (Naysilla Mirdad) dan Aris (Rionaldo Stokhorst) semakin renggang di sinetron...
"Beredar Isu Sinetron Prilly Latuconsina Bakal Gantikan ‘STJC’, Hoax?",iyaa.com | Jakarta: Kabar mengejutkan datang dari sinetron Siapa Takut Jatuh Cinta (STJC). Baru-baru ini...
"‘APACE’, Anak Punk Anti Cewek Segera Tayang di RCTI","iyaa.com | Jakarta: RCTI siapkan sinetron komedi terbarunya berjudul APACE, Anak Punk Anti Cewek. Sinetron..."
"Vinessa Inez Muncul Lagi di ‘JWB’, Ini yang Dikangenin dari Sista",
Abdul Terharu Sang Ayah Nonton Langsung ‘Indonesian Idol 2018’,
"Sinopsis ‘Dia yang Tak Terlihat’, Kisah Cinta Berbalut Misteri Pembunuhan",
"Pakai Hot Pants dan Kaos Ketat, Ashanty Banjir Protes Netizen",
4 Mitos dan Fakta Seputar Aloe Vera Gel untuk Kecantikan,
"Mirip ‘Putri yang Ditukar’, Begini Sinopsis ‘Ada Dua Cinta’ RCTI",
"‘Pesbukers’ Balik ke Slot Sore, ‘Dil Se Dil Tak’ Dibungkus ANTV?",
"Serial India Baru ANTV, Ini rating ‘Mahakaali’ dan ‘Takdir Lonceng Cinta’",
"Lamarannya Ditolak, Mas Pur Pingsan di ‘Tukang Ojek Pengkolan’",
"Menderita Batu Ginjal, Aly Goni Masuk Rumah Sakit",
‘Tercyduk’ SCTV Asli Atau Settingan? Begini Jawaban Lionil Hendrik,
Serial Tokusatsu ‘Legend Hero’ akan Tayang di RTV,
"Yuk, Kenalan Sama Pemain & Karakter ‘APACE, Anak Punk Anti Cewek’ RCTI",
"Pindah Jam Tayang, ‘Hafizah’ Masuki Episode Terakhir di RCTI",
"Dibilang Kembaran Dewi Perssik, Suara Rashami Desai Merdu Banget",
"Diprotes Keras Usai Muncul di TV, Ini Kata Lucinta Luna",
Malam Puncak ‘Miss Indonesia 2018’ Disiarkan RCTI Malam Ini,
"Sinopsis ‘Dia yang Tak Terlihat’, Kisah Cinta Berbalut Misteri Pembunuhan",
"Mirip ‘Putri yang Ditukar’, Begini Sinopsis ‘Ada Dua Cinta’ RCTI",
"‘Pesbukers’ Balik ke Slot Sore, ‘Dil Se Dil Tak’ Dibungkus ANTV?",
Supermodel Karlie Kloss Jadi Global Ambassador Baru Estee Lauder,"iyaa.com | Jakarta: Brand kosmetik ternama Estee Lauder, baru saja memperkenalkan brand ambassador global terbaru..."
Jaga Kelembapan Kulitmu dengan Rangkaian Pixy White Aqua Series,"iyaa.com | Jakarta: Tinggal di kota besar pasti kamu akan selalu berhadapan dengan polusi, debu,..."
Mawar Eva De Jongh Tertantang Perankan Sosok Kania ‘Dia yang Tak Terlihat’,"iyaa.com | Jakarta: Mawar Eva De Jongh kini bintangi sinetron terbaru RCTI, Dia yang Tak..."
Ini Dia Makeup yang Digunakan Beyonce di Festival Coachella 2018,"iyaa.com | Jakarta: Festival Coachella 2018 menyimpan banyak cerita, salah satu yang menjadi perbincangan hangat..."
"Tantri Syailindri Berhijab, Kotak Band Didukung Tetap Eksis di Indonesia",iyaa.com | Jakarta: Penampilan Tantri Syailindri berubah setelah pulang umroh beberapa lalu. Vokalis band Kotak...
"Sarung Bantal Ini Diklaim Bisa Mencegah Jerawat dan Rambut Kusut, Beneran?",iyaa.com | Jakarta: Sarung bantal kecantikan yang satu ini diklaim bisa mengatasi masalah wajah dan...
"‘Swaragini’ Sudah Lama Tamat, Tejasswi Prakash Dkk Reunian",iyaa.com | Mumbai: Serial Swaragini sudah lama tamat di India yakni pada 2016 lalu. Namun...
"Ungkap Alasan Berhijab, Tika Bravani Didukung Penuh Sariayu Martha Tilaar",iyaa.com | Jakarta: Tika Bravani memutuskan untuk berhijab usai pulang Umroh bersama pemain dan kru...
Kolaborasi Puma x MAC Mudahkan Kamu Padu Padan Sneakers dengan Warna Lipstik,iyaa.com | Jakarta: Salah satu kesulitan perempuan adalah mencocokkan warna lipstik dengan sneakers-nya. Tapi sekarang...
Billy Davidson Kaget Dapat Tawaran Main di ‘Dunia Terbalik’,iyaa.com | Jakarta: Billy Davidson ikut bermain dalam sinetron Dunia Terbalik di RCTI. Dalam sinetron...
"Air Cushion Foundation, Cushion dari Mineral Botanica yang Cocok dengan Skin Tone Perempuan Indonesia","iyaa.com | Jakarta: Inovasi dalam industri kecantikan terus bermunculan, salah satunya cushion yang dipopulerkan Korea..."
Berikut Cara Tepat Aplikasikan Liquid Foundation Sesuai Jenis Kulit,"iyaa.com | Jakarta: Terkadang tak mudah bagi kita untuk aplikasikan liquid foundation. Jika kurang teliti,..."
"Promosi ‘Ishq Ka Rang Safed’, Mishal Raheja Sapa Fans Indonesia","iyaa.com | Jakarta: Setelah Nakusha (Laagi Tujhse Lagan), satu lagi serial Mishal Raheja akan segera..."
"Heboh Beyonce Ganti Warna Cat Kuku di Festival Coachella, Ternyata…",iyaa.com | Jakarta: Festival Musik dan Seni Coachella 2018 yang berlangsung sejak 13 April kemarin...
"Verrell Bramasta Dikritik Netizen Karena Perannya di ‘STJC’, Kenapa?",iyaa.com | Jakarta: Peran Verrell Bramasta di sinetron Siapa Takut Jatuh Cinta SCTV tuai kritikan...
"Kocak Abis, Begini Jadinya Kalau Produk Terbaru Rihanna Diparodikan Laki-Laki","iyaa.com | Jakarta: Beauty line milik Rihanna, Fenty Beauty, pada tanggal 6 April lalu merilis..."
"Pakai Hot Pants dan Kaos Ketat, Ashanty Banjir Protes Netizen",
Shweta Basu Prasad Terkesan dengan Cinta Fans Indonesia,iyaa.com | Jakarta: Selama beberapa hari Shweta Basu Prasad berada di Indonesia untuk bertemu penggemarnya....
"Bikin Vlog, Rifky Balweel Alami Kejadian Mistis?",iyaa.com | Jakarta: Rifky Balweel alami kejadian mistis saat pertama kali membuat vlog atau video...
4 Mitos dan Fakta Seputar Aloe Vera Gel untuk Kecantikan,
"Serial India Baru ANTV, Ini rating ‘Mahakaali’ dan ‘Takdir Lonceng Cinta’",
Pelajaran Hidup yang Didapat Robby Purba dari ‘Karma’ ANTV,iyaa.com | Jakarta: Robby purba akui banyak mendapatkan pelajaran hidup setelah memandu program Karma ANTV...
"Lamarannya Ditolak, Mas Pur Pingsan di ‘Tukang Ojek Pengkolan’",
"Menderita Batu Ginjal, Aly Goni Masuk Rumah Sakit",
‘Tercyduk’ SCTV Asli Atau Settingan? Begini Jawaban Lionil Hendrik,
"Tampil Beda di ‘Brownis’, Chacha Frederica Mantap Berhijab","iyaa.com | Jakarta: Kembali jadi bintang tamu di Brownis (Obrowlan Manis) trans TV, Chacha Frederica..."
"Pakai Hot Pants dan Kaos Ketat, Ashanty Banjir Protes Netizen",
Serial Tokusatsu ‘Legend Hero’ akan Tayang di RTV,
"Yuk, Kenalan Sama Pemain & Karakter ‘APACE, Anak Punk Anti Cewek’ RCTI",
"Pindah Jam Tayang, ‘Hafizah’ Masuki Episode Terakhir di RCTI",
4 Mitos dan Fakta Seputar Aloe Vera Gel untuk Kecantikan,
"Serial India Baru ANTV, Ini rating ‘Mahakaali’ dan ‘Takdir Lonceng Cinta’",
8 Kesalahan Sepele Pakai Foundation Ini Bisa Buat Makeupmu Berantakan (Bag.1),
"Kalahkan Jerman 2-0 di Piala Dunia 2018, Kiper Korea Ini Dibilang Mirip Roy Kiyoshi",
"Lamarannya Ditolak, Mas Pur Pingsan di ‘Tukang Ojek Pengkolan’",
"Menderita Batu Ginjal, Aly Goni Masuk Rumah Sakit",
‘Tercyduk’ SCTV Asli Atau Settingan? Begini Jawaban Lionil Hendrik,
"Angkat Kisah Pelakor, Jam Tayang ‘Hafizah’ RCTI Dinilai Tak Sesuai",
"Sinopsis ‘Dia yang Tak Terlihat’, Kisah Cinta Berbalut Misteri Pembunuhan",
"Mirip ‘Putri yang Ditukar’, Begini Sinopsis ‘Ada Dua Cinta’ RCTI",
Serial Tokusatsu ‘Legend Hero’ akan Tayang di RTV,
"Yuk, Kenalan Sama Pemain & Karakter ‘APACE, Anak Punk Anti Cewek’ RCTI",
"‘Pesbukers’ Balik ke Slot Sore, ‘Dil Se Dil Tak’ Dibungkus ANTV?",
"‘Di Luar Nalar’ Tayang Perdana, Netizen Ikut Berbagi Cerita Misteri","iyaa.com | Jakarta: Program baru RCTI, Di Luar Nalar tayang perdana siang ini, Rabu 4..."
"Pindah Jam Tayang, ‘Hafizah’ Masuki Episode Terakhir di RCTI",
"Hyaluronic Acid, Ingredients dalam Skincare yang Lagi Hype Banget",
"‘Di Luar Nalar’, Mengulik Beragam Mitos dan Urban legend di RCTI","iyaa.com | Jakarta: RCTI hadirkan satu program entertainment terbarunya, Di Luar Nalar. Sesuai dengan judulnya,..."
"LIDA Top 15: Kalah Saing, Hariyanti Tersisih dari Grup 2",iyaa.com | Jakarta: Duta Sulawesi Tengah harus pulang dari Liga Dangdut Indonesia (LIDA). Hariyanti yang...
Ini Alasan NET Undang Craig David & Hailee Steinfeld di Indonesian Choice Awards 5.0,"iyaa.com | Jakarta: NET kembali menggelar ajang Indonesian Choice Awards 5.0. Di tahun 2018 ini,..."
"Gantikan ‘Ummi’, ‘Oh Mama, Oh Papa…’ Tayang Lagi di ANTV",
"Pooja Sharma dan Saurabh Raj Jain Tiba di Indonesia, Netizen: Welcome Back!",
"Sinopsis ‘Dia yang Tak Terlihat’, Kisah Cinta Berbalut Misteri Pembunuhan",
"Stefan William Nikah, ‘Anak Langit’ Diprotes Netizen?",iyaa.com | Jakarta: Stefan William dan Nasya Marcella akan segera menyusul jejak Caesar Hito dan...
"Bosan dengan Penindasan, Alyssa Soebandono Diminta Kuat di ‘Cinta Kedua’","iyaa.com | Jakarta: Tayang perdana kemarin, Senin (2/4/2018), sinetron Cinta Kedua sudah menguras air mata..."
"Mirip ‘Putri yang Ditukar’, Begini Sinopsis ‘Ada Dua Cinta’ RCTI",
"‘Pesbukers’ Balik ke Slot Sore, ‘Dil Se Dil Tak’ Dibungkus ANTV?",
"Geser Rionaldo Stokhorst, Marcel Chandrawinata – Marshanda Bikin Baper di ‘OK3’",iyaa.com | Jakarta: Hadirnya Marcel Chandrawinata di sinetron Orang Ketiga mencuri perhatian para penggemar. Aktingnya...
"Irsyadillah Gabung ‘Ada Dua Cinta’, Rizky Billar Meninggal?",iyaa.com | Jakarta: Pendatang baru muncul di sinetron Ada Dua Cinta. Aktor tampan di sinetron...
10 Judul Sinema Indosiar Ini Bikin Netizen Mikir Keras,"iyaa.com | Jakarta: Beragam Film Televisi (FTV) kerap ditayangkan Indosiar. Bertajuk Sinema Indosiar, FTV yang..."
"LIDA Top 15: Tampil Ngerock Bareng Fildan, Rara Pimpin Grup 2 Sementara","iyaa.com | Jakarta: Usai tersisihnya Mahania, kini giliran duta dari Grup 2 tampil di Liga..."
"Pakai Hot Pants dan Kaos Ketat, Ashanty Banjir Protes Netizen",
4 Mitos dan Fakta Seputar Aloe Vera Gel untuk Kecantikan,
"Serial India Baru ANTV, Ini rating ‘Mahakaali’ dan ‘Takdir Lonceng Cinta’",
"Lamarannya Ditolak, Mas Pur Pingsan di ‘Tukang Ojek Pengkolan’",
"Menderita Batu Ginjal, Aly Goni Masuk Rumah Sakit",
‘Tercyduk’ SCTV Asli Atau Settingan? Begini Jawaban Lionil Hendrik,
Serial Tokusatsu ‘Legend Hero’ akan Tayang di RTV,
"Yuk, Kenalan Sama Pemain & Karakter ‘APACE, Anak Punk Anti Cewek’ RCTI",
"Pindah Jam Tayang, ‘Hafizah’ Masuki Episode Terakhir di RCTI",
"Cassandra Lee Gabung SinemArt, Megan Domani Jadi Protagonis di ‘Seleb’?",
"Heboh Kasus Cinta Segitiga, Kriss Hatta Banjir Dukungan Fans",
"Pakai Baking Soda dalam Rutinitas Kecantikan, Baik Gak Sih untuk Kulit?",
"Sinopsis ‘Dia yang Tak Terlihat’, Kisah Cinta Berbalut Misteri Pembunuhan",
"Mirip ‘Putri yang Ditukar’, Begini Sinopsis ‘Ada Dua Cinta’ RCTI",
"‘Pesbukers’ Balik ke Slot Sore, ‘Dil Se Dil Tak’ Dibungkus ANTV?",
"Dianggap Biasa, Perilaku Ini Ternyata Bisa Picu Jerawat Loh",iyaa.com | Jakarta: Punya kulit berjerawat memang tak menyenangkan. Seringkali mengatasi jerawat di wajah menjadi...
Wardah Hadirkan Eyebrow Kit Untuk Bentuk Alis Sempurnamu,"iyaa.com | Jakarta: Alis merupakan bingkai wajah yang jadi penentu kecantikan seseorang. Selain itu, Alis..."
"Datangi KPI, Ely Sugigi Minta Maaf Terkait Kata Kotor di ‘Pesbukers’","iyaa.com | Jakarta: Ely Sugigi sambangi kantor Komisi Penyiaran Indonesia (KPI) kemarin, Senin (26/3/2018). Kedatangan..."
"Roy Kiyoshi Ungkap Pernikahan Dewi Perssik, dari Tangisan Darah Hingga Kelabang","iyaa.com | Jakarta: Pernikahan Dewi Perssik dan Angga Wijaya masuk dalam rangkaian acara HUT ANTV,..."
"Atasi Jerawat dengan Tea Tree Oil, Ini Kelebihan dan Kekurangannya",iyaa.com | Jakarta: Salah satu bahan alami yang ampuh untuk mengatasi jerawat adalah tea tree...
"Sepele Banget, 5 Kebiasaan Ini Ternyata Dapat Merusak Rambutmu","iyaa.com | Jakarta: Rambut yang indah tentu jadi dambaan banyak wanita. Namun karena beberapa faktor,..."
"Jadi Pemeran Utama di ‘Malaikat Cinta’, Omar Daniel Bikin Penasaran",iyaa.com | Jakarta: Rumah produksi SinemArt siapkan beberapa sinetron terbaru yang akan segera tayang di...
"Dituding Operasi Plastik, Ini Jawaban Fay Nabila",iyaa.com | Jakarta: Fay Nabila kini sering muncul di layar kaca lewat sinetron Orang Ketiga...
NARS Kolaborasi Bareng Erdem Moralioglu Ciptakan Strange Flowers,iyaa.com | Jakarta: Kolaborasi untuk menciptakan makeup baru bukan hal baru di industri kecantikan. Kali...
Brand Ini Rilis Lipstik Neon yang Bikin Bibirmu Glow In The Dark,"iyaa.com | Jakarta: Suka dengan lipstik warna terang? Jika ya, kamu harus coba lipstik neon..."
"Cobain Yuk ‘Google Picks My Makeup Challenge’, Tren Challenge Baru untuk Para Pecinta Makeup",iyaa.com | Jakarta: Kamu pasti pernah mencoba atau paling gak denger No Mirror Makeup Challenge...
"Selesai Konser di Indonesia, Katy Perry Langsung Ubah Warna Rambutnya",iyaa.com | Jakarta: Penyanyi Katy Perry baru saja melaksanakan konser untuk ketiga kalinya di Indonesia...
"Penampilan Baru Jessica Iskandar Bikin Pangling, Apa yang Beda?",iyaa.com | Jakarta: Jessica Iskandar baru-baru ini pamit dalam program Pesbukers ANTV untuk terbang ke...
"Totalitas di ‘Anak Langit’, Sasha Alexa – Bude Merry Sampai Jatuh Ke Liang Kubur",iyaa.com | Jakarta: Sasha Alexa menunjukkan totalitasnya di dunia akting. Pemeran Bude Merry di sinetron...
"Anji Bersedia Buatkan Lagu, Ini Komentar Ghea ‘Idol’",iyaa.com | Jakarta: Tereliminasinya Ghea Indrawari membuat para penggemar kecewa termasuk Anji. Ghea menjadi finalis...
"Tanpa Makeup Remover, 5 Cara Ini Juga Ampuh Hapus Sisa Liquid Lipstik",iyaa.com | Jakarta: Liquid lipstik jadi pilihan banyak perempuan karena long lasting dan pigmented. Cukup...
"Pakai Hot Pants dan Kaos Ketat, Ashanty Banjir Protes Netizen",
"‘Hafizah’ Tamat di RCTI, Sosok Maghda Melekat di Fanny Fabriana",iyaa.com | Jakarta: Sinetron Hafizah masuki episode-episode terakhirnya di RCTI. Segenap kru dan pemain juga...
"Bintangi ‘Dev 2’, Jigyasa Singh Ingin Lepas dari Imej ‘Thapki’",iyaa.com | New Delhi: Jigyasa Singh akan segera kembali ke layar kaca dengan serial Dev...
4 Mitos dan Fakta Seputar Aloe Vera Gel untuk Kecantikan,
"Serial India Baru ANTV, Ini rating ‘Mahakaali’ dan ‘Takdir Lonceng Cinta’",
"Lamarannya Ditolak, Mas Pur Pingsan di ‘Tukang Ojek Pengkolan’",
"Setelah Kodaline dan Adam Levine, Abdul ‘Idol’ Diapresiasi Calum Scott",iyaa.com | Jakarta: Penampilan Ahmad Abdul di Indonesian Idol 2018 ikut menarik perhatian para musisi...
"Giovanni Tobing Ganti Penampilan, Samuel Zylgwyn Komentar Kocak",iyaa.com | Jakarta: Ada yang baru dari Giovanni Tobing. Pemeran Riko itu akan ganti penampilan...
"Menderita Batu Ginjal, Aly Goni Masuk Rumah Sakit",
‘Tercyduk’ SCTV Asli Atau Settingan? Begini Jawaban Lionil Hendrik,
Serial Tokusatsu ‘Legend Hero’ akan Tayang di RTV,
"Pakai Hot Pants dan Kaos Ketat, Ashanty Banjir Protes Netizen",
4 Mitos dan Fakta Seputar Aloe Vera Gel untuk Kecantikan,
